ID,Title,Latitude,Longitude,Country,Location,Region,"Type of Legal Provision",Status_1_Primary,Status_1_Year,Status_1_Secondary,Status_2_Primary,Status_2_Year,Status_2_Secondary,Status_3_Primary,Status_3_Year,Status_3_Secondary,Status_4_Primary,Status_4_Year,Status_4_Secondary,Status_5_Primary,Status_5_Year,Status_5_Secondary,"Year Initiated","Theoretical Framing",RoN,Personhood,AnimalRights,LEK,Indigenous,EcoGov,"Type of Ecological Jurisprudence","Initiating Actor Name",Indigenous.1,NGO,CivSoc,International,Government,Court,"Initiating Actor Type","Ecological Actor Name","Ecological Actors","Identified Ecosystem","Caretaking System","Caretaking Actor",Representation,Synopsis,Permalink
1,"U.S. Supreme Court Case: Sierra Club v. Morton (should trees have legal standing)",36.7905079,-120.0679899,US|USA,USA,"North America","Court Case",Submitted,1969,,,Failed,1972,,,,,,,,,,1969,"Legal Personhood; legal standing for nature (P. 6-7)",1,1,0,0,0,0,"Rights Of Nature|Personhood","Sierra Club; Supreme Court Justice Douglas",0,1,0,0,0,1,NGO|Court,"The Mineral King Valley",Forest,1,0,0,0,"In 1972 Supreme Court Justice Douglas wrote a dissent arguing that the Mineral King Valley should have standing to sue for its own preservation.",https://ecojurisprudence.org/initiatives/sierra-v-morton/
2,"Tamaqua Borough (USA) Ordinance: sewage sludge and rights of nature",40.7973,-75.9694,US|USA,"Pennsylvania, USA","North America",Legislation,Approved,2006,,,,,,,,,,,,,,2006,"Nature as ""natural communities"" that should be considered ""persons"" for purposes of enforcing their civil rights (Sec 7.6)",1,1,0,0,0,0,"Rights Of Nature|Personhood","Army For A Clean Environment; CELDF",0,1,1,0,0,0,"Civil Society|NGO","Natural communities and ecosystems","All Nature",,1,3,2,"In 2006, Tamaqua, Pennsylvania passed a local ordinance recognizing rights of nature and banning corporations from disposing of sewage sludge.",https://ecojurisprudence.org/initiatives/tamaqua-borough-sewage-sludge-ordinance/
3,"Ecuador Constitution of 2008: rights of nature",-0.2130957,-78.5688972,EC|Ecuador,Ecuador,"Latin America",Constitution,Submitted,2007,,,Approved,2008,,,,,,,,,,2007,"Rights of Nature (defined as Pachamama) portrayed a part of a collection of rights that is a tool for achieving the development approach ""buen vivir"" (sumak kawsay) (Preamble, Chapter 7)",1,0,0,0,1,0,"Rights Of Nature|Indigenous Model","Constituent Assembly of Ecuador, with submissions from civil society",1,0,1,0,1,0,"Government|Civil Society|Indigenous",Pachamama,"All Nature",,1,3,2,"In 2008, Ecuador adopted a new constitution recognizing rights of nature, or Pachamama, with goals of harmony with nature and the concept of good living.",https://ecojurisprudence.org/initiatives/ecuador-constitution/
4,"Hawaii (USA) court case: Palila v. Hawaii Department of Land and Natural Resources",21.3069,-157.8583,US|USA,"Hawaii, USA","North America","Court Case",Submitted,1979,,,Approved,1981,,,,,,,,,,1979,"""Thus, the presence of mouflon sheep on Mauna Kea threatens the continued existence and the recovery of the Palila species"" (Page",0,0,0,0,0,1,"Eco-Governance System","Michael R. Sherwood, Sierra Club Legal Defense Fund, Inc., San Francisco, Cal., for plaintiffs-appellees",0,1,1,0,0,0,"NGO|Civil Society","The Palila",Animal,1,0,0,0,"The Sierra Club won a 1981 lawsuit to protect Palila and their habitat from harm by Hawaii's game management practices involving feral goats and sheep.",https://ecojurisprudence.org/initiatives/palila-v-hawaii-department-of-lane-and-natural-resources/
5,"Florida (USA) court case: Loggerhead Turtle v. County Council of Volusia County",28.5383,-81.3792,US|USA,"Florida, USA","North America","Court Case",Submitted,1995,,,Approved,1998,,,,,,,,,,1995,"""Instead, the Court is called upon to ascertain whether the County's activities will likely result in future takings of protected sea turtles"" (Page 10 of first instance).",0,0,0,0,0,1,"Eco-Governance System","Shirley Reynolds and Rita Alexander",0,0,1,0,0,0,"Civil Society","Loggerhead Turtle","Animal|Marine Ecosystem",1,0,0,0,"Citizens who filed a lawsuit on behalf of Loggerhead and Green turtles facing barriers to reach the ocean from county vehicles partially lost the case in 1995.",https://ecojurisprudence.org/initiatives/loggerhead-turtle-v-county-council-of-volusia-county/
6,"USA Federal Court Case: Cetacean Community v. Bush",38.9072,-77.0369,US|USA,USA,"North America","Court Case",Failed,2004,,,,,,,,,,,,,,2004,"""Through their attorney, the Cetaceans contend that SURTASS LFAS harms them by causing tissue damage and other serious injuries, and by disrupting biologically important behaviors including feeding and mating"" (Page 2).",1,1,1,0,0,0,"Rights Of Nature|Personhood|Animal Rights","Cetacean Community (Plaintiff); Lanny Sinkin (lawyer)",0,0,1,0,0,0,"Civil Society",Cetaceans,"Animal|Marine Ecosystem",1,0,0,0,"In 2004, the “Cetacean Community” (plaintiffs) filed and lost a lawsuit to halt actions by the U.S. Navy that cause harm to Cetaceans.",https://ecojurisprudence.org/initiatives/cetacean-community-v-bush/
7,"Barnstead (USA) Town Ordinance: community water rights and rights of nature",43.3389,-71.2782,US|USA,"New Hampshire, USA","North America",Legislation,Approved,2006,,,,,,,,,,,,,,2006,"""We the People of the Town of Barnstead declare that we have the duty to safeguard the water both on and beneath the Earth’s surface, and in the process, safeguard the rights of people within the community of Barnstead, and the rights of the ecosystems of which Barnstead is a part"" (Page 1).",1,0,0,0,0,0,"Rights Of Nature",CELDF,0,1,0,0,0,0,NGO,"Water; Ecosystems","All Nature",1,1,3,2,"Barnstead, New Hampshire adopted an ordinance recognizing water rights and the rights of nature and limiting corporate powers within the town in 2006.",https://ecojurisprudence.org/initiatives/barnstead-water-rights-and-local-self-government-ordinance/
8,"Rush Township (USA) Ordinance: sewage sludge and rights of nature",40.8321,-75.9812,US|USA,"Pennsylvania, USA","North America",Legislation,Approved,2006,,,,,,,,,,,,,,2006,"""Natural communities and ecosystems possess inalienable and fundamental rights to exist and flourish"" (page 5 of Part 2).",1,0,0,0,0,0,"Rights Of Nature","CELDF; Pennsylvania Community Rights Network",0,1,0,0,0,0,NGO,"Natural communities and ecosystems","All Nature",,2,1,0,"In 2006, Rush Township in Pennsylvania recognizing rights of nature and banning corporations from the land application of sewage sludge within the township.",https://ecojurisprudence.org/initiatives/rush-township-sewage-sludge-ordinance/
9,"Blaine Township (USA) Ordinance: corporate land development and rights of nature",40.1850,-80.3993,US|USA,"Pennsylvania, USA","North America",Legislation,Approved,2006,,,,,,,,,,,,,,2006,"""Natural communities and ecosystems possess inalienable and fundamental rights to exist and flourish within Blaine Township"" (page 2).",1,0,0,0,0,0,"Rights Of Nature","Residents of the Township of Blaine; CELDF",0,1,1,0,0,0,"Civil Society|NGO","Natural communities and ecosystems","All Nature",,1,3,2,"Blaine, Pennsylvania passed an ordinance recognizing rights of nature and preventing land development from non-family corporations within the township in 2006.",https://ecojurisprudence.org/initiatives/blaine-township-corporate-land-development-ordinance/
10,"Montgomery County (USA) Ordinance: anti-corporate takings and local self-governance",37.2070,-80.4104,US|USA,"Virginia, USA","North America",Legislation,Approved,2006,,,,,,,,,,,,,,2006,"""Natural communities and ecosystems possess inalienable and fundamental rights to exist and flourish within the County of Montgomery. Ecosystems shall include, but not be limited to, forests, meadows, caverns, wetlands, streams, rivers, aquifers, and other water systems."" (3)",1,1,0,0,0,0,"Rights Of Nature|Personhood",CELDF,0,1,0,0,0,0,NGO,"Natural communities and ecosystems","All Nature",,2,1,0,"Members of CELDF drafted an ordinance for Montgomery County in Virginia recognizing rights of nature and residents’ rights to a healthy environment in 2006.",https://ecojurisprudence.org/initiatives/montgomery-county-anti-corporate-takings-and-securing-local-self-governance-ordinance/
11,"East Brunswick (USA) Ordinance: sewage sludge and rights of nature",40.6702,-75.9579,US|USA,"Pennsylvania, USA","North America",Legislation,Approved,2006,,,Failed,2008,,,,,,,,,,2006,"""Natural communities and ecosystems possess inalienable and fundamental rights to exist and flourish within the Township of East Brunswick"" (Page 4).",1,1,0,0,0,0,"Rights Of Nature|Personhood","Pennsylvania Community Rights Network",0,1,0,0,0,0,NGO,"Natural communities and ecosystems","All Nature",,1,3,2,"In 2008, a court overturned a 2006 East Brunswick, Pennsylvania ordinance recognizing rights of nature and banning certain corporate uses of sewage sludge.",https://ecojurisprudence.org/initiatives/east-brunswick-township-sewage-sludge-ordinance/
12,"Campbell County (USA) Ordinance: sewage sludge and rights of nature",37.2210,-79.1097,US|USA,"Virginia, USA","North America",Legislation,Drafted,2007,,,,,,,,,,,,,,2007,""" Natural communities and ecosystems possess inalienable and fundamental rights to exist and flourish within the
County of Campbell"" (Page 4).",1,1,0,0,0,0,"Rights Of Nature|Personhood",CELDF,0,1,0,0,0,0,NGO,"Natural communities and ecosystems","All Nature",,1,3,2,"In 2007, CELDF drafted an ordinance for Campbell County, Virginia recognizing rights of nature and banning the corporate land application of sewage sludge.",https://ecojurisprudence.org/initiatives/campbell-county-sewage-sludge-ordinance/
13,"Tamaqua Borough (USA) Ordinance: corporate waste and local control",40.7973,-75.9694,US|USA,"Pennsylvania, USA","North America",Legislation,Approved,2007,,,,,,,,,,,,,,2007,"""Borough  residents,  natural communities,  and  ecosystems  shall  be  considered  to  be  ‘persons’  for purposes  of  enforcement  of  the  civil  rights  of  those  residents,  natural communities  and  ecosystems.""",1,1,0,0,0,0,"Rights Of Nature|Personhood",CELDF,0,1,0,0,0,0,NGO,"Natural communities and ecosystems","All Nature",,1,3,2,"In 2007, Tamaqua Borough, Pennsylvania adopted an ordinance recognizing rights of nature and banning corporations from dumping toxic waste.",https://ecojurisprudence.org/initiatives/tamaqua-borough-corporate-waste-and-local-control-ordinance/
14,"Bethel (USA) Ordinance: corporate toxics and local self-governance",60.7922,-161.7558,US|USA,"Alaska, USA","North America",Legislation,Drafted,2007,Dormant,,,,,,,,,,,,,2007,"""Natural communities and ecosystems possess inalienable and fundamental rights to exist and flourish within the City of Bethel and its watershed"" (Page 3).",1,1,0,0,0,0,"Rights Of Nature|Personhood",CELDF,0,1,0,0,0,0,NGO,"Natural communities and ecosystems","All Nature",,1,3,2,"In 2007, CELDF drafted an ordinance for Bethel, Alaska recognizing rights of nature and banning toxic substances within the city and its watershed.",https://ecojurisprudence.org/initiatives/bethel-corporate-toxics-and-local-self-governance-ordinance/
15,"Peach Bottom Township (USA) Ordinance: sustainable agriculture, community rights, and rights of nature",39.7506,-76.2269,US|USA,"Pennsylvania, USA","North America",Legislation,Failed,2007,,,,,,,,,,,,,,2007,"""Natural communities and ecosystems possess inalienable and fundamental rights to exist and flourish within the Township of Peach Bottom"" (Page 6).",1,1,0,0,0,0,"Rights Of Nature|Personhood",CELDF,0,1,0,0,0,0,NGO,"Natural communities and ecosystems","All Nature",,1,3,2,"An ordinance for Peach Bottom, Pennsylvania recognizing rights of nature, personhood for nature, and banning corporate sewage sludge failed to pass in 2007.",https://ecojurisprudence.org/initiatives/peach-bottom-township-sustainable-agriculture-and-community-self-government-ordinance/
16,"North Plainfield (USA) Ordinance: community rights and rights of nature",40.6301,-74.4274,US|USA,"New Jersey, USA","North America",Legislation,Failed,2007,,,,,,,,,,,,,,2007,"""Natural communities and ecosystems possess inalienable and fundamental rights to exist and flourish within the Borough of North Plainfield"" (Page 3).",1,1,0,0,0,0,"Rights Of Nature|Personhood","CELDF; North Plainfield Citizens for Community Rights",0,1,1,0,0,0,"NGO|Civil Society","Natural communities and ecosystems","All Nature",,1,3,2,"In 2007, an ordinance in North Plainfield, New Jersey recognizing rights of nature and prohibiting the use of certain corporations for land development failed.",https://ecojurisprudence.org/initiatives/borough-of-north-plainfield-corporate-land-development-and-local-self-government-ordinance/
17,"Atkinson (USA) Ordinance: community water rights and rights of nature",42.8384,-71.1470,US|USA,"New Hampshire, USA","North America",Legislation,Approved,2007,,,,,,,,,,,,,,2007,"""Natural  communities  and ecosystems  possess  inalienable and fundamental  rights  to exist  and flourish within the Town  of  Atkinson"" (Page 2).",1,1,0,0,0,0,"Rights Of Nature|Personhood","People of the Town of Atkinson",0,0,1,0,0,0,"Civil Society","Water; Natural communities and ecosystems","All Nature",,1,3,2,"Atkinson, New Hampshire passed an ordinance recognizing personhood for nature and residents’ right to use water from sustainable water cycles in 2008.",https://ecojurisprudence.org/initiatives/atkinson-water-withdrawal-control-ordinance/
18,"Halifax (USA) Ordinance: corporate mining, chemical trespass, community rights, and rights of nature",36.7660,-78.9283,US|USA,"Virginia, USA","North America",Legislation,Approved,2008,,,,,,,,,,,,,,2008,"""Natural communities and ecosystems, including, but not limited to, wetlands, streams, rivers, aquifers, and other water systems, possess inalienable and fundamental rights ro exist and flourish within the town of Halifax"" (Page 6).",1,0,0,0,0,0,"Rights Of Nature","citizens of the Town of Halifax",0,0,1,0,0,0,"Civil Society","Natural communities and ecosystems","All Nature",,1,3,2,"In 2008, the town of Halifax, Virginia passed an ordinance recognizing rights of nature and opposing corporate mining.",https://ecojurisprudence.org/initiatives/halifax-corporate-mining-and-chemical-and-radioactive-bodily-trespass-ordinance/
19,"Mahanoy Township (USA) Ordinance: sewage sludge and rights of nature",40.8322,-76.1436,US|USA,"Pennsylvania, USA","North America",Legislation,Approved,2008,,,,,,,,,,,,,,2008,"""Natural communities and ecosystems possess inalienable and fundamental rights to exist and flourish within the Township of Mahanoy"" (page 7).",1,1,0,0,0,0,"Rights Of Nature|Personhood","CELDF; residents",0,1,1,0,0,0,"NGO|Civil Society","Natural communities and ecosystems","All Nature",,1,3,2,"Mahanoy, Pennsylvania passed an ordinance recognizing rights of nature and limiting the powers of corporations within the township in 2008.",https://ecojurisprudence.org/initiatives/mahanoy-township-sewage-sludge-ordinance/
20,"Nottingham (USA) Ordinance (2008): community water rights and rights of nature",43.1145,-71.0998,US|USA,"New Hampshire, USA","North America",Legislation,Approved,2008,,,,,,,,,,,,,,2008,"""It shall be unlawful...to interfere with the rights of natural communities and ecosystems to exist and flourish, or to cause  damage to those natural communities and ecosystems"" (page 2).",1,1,0,0,0,0,"Rights Of Nature|Personhood","CELDF; residents",0,1,1,0,0,0,"NGO|Civil Society","Natural communities and ecosystems","All Nature",,1,3,2,"Nottingham, New Hampshire passed an ordinance recognizing rights of nature and banning corporate water withdrawals for resale within the township in 2008.",https://ecojurisprudence.org/initiatives/nottingham-water-rights-and-local-self-government-ordinance/
21,"Blaine Township (USA) Ordinance (2008): corporate taking ban and rights of nature",40.1850,-80.3993,US|USA,"Blaine Township, Pennsylvania","North America",Legislation,Approved,2008,,,,,,,,,,,,,,2008,"""Rights of Natural Communities. Natural communities and ecosystems, including, but not limited to, wetlands, streams, rivers, aquifers, and other water systems, possess inalienable and fundamental rights to exist and flourish within the Township of Blaine"" (Page 4).",1,0,0,0,0,0,"Rights Of Nature","CELDF and residents",0,1,1,0,0,0,"NGO|Civil Society","Natural communities and ecosystems","All Nature",,1,3,2,"Blaine Township, Pennsylvania passed an ordinance recognizing rights of nature and banning corporations from taking private property in the township in 2008.",https://ecojurisprudence.org/initiatives/blaine-township-community-self-governance-and-corporate-takings-prohibition-ordinance/
22,"Nockamixon (USA) Ordinance: corporate mining, bodily trespass, and democratic self-government",40.5297,-75.1662,US|USA,"Pennsylvania, USA","North America",Legislation,Approved,2008,,,,,,,,,,,,,,2008,"""Natural communities and ecosystems, including, but not limited to, wetlands, streams, rivers, aquifers, and other water systems, possess inalienable and fundamental rights to exist and flourish within the Township of Nockamixon"" (Page 4).",1,0,0,0,0,0,"Rights Of Nature","CELDF; Pennsylvania Community Rights Network",0,1,0,0,0,0,NGO,"Natural communities and ecosystems","All Nature",,1,3,2,"Nockamixon Township, Pennsylvania passed an ordinance recognizing rights of nature and banning corporate mining and chemical trespass in the township in 2008.",https://ecojurisprudence.org/initiatives/nockamixon-township-corporate-mining-bodily-trespass-and-democratic-self-government-ordinance/
23,"Newtown Township (USA) Ordinance: community rights and rights of nature",39.9841225,-75.4012981,US|USA,"Pennsylvania, USA","North America",Legislation,Drafted,2008,,,Approved,2009,,,,,,,,,,2008,"""Natural communities and ecosystems, including, but not limited to, wetlands, streams, rivers, aquifers, and other water systems, possess inalienable and fundamental rights to exist and flourish within the Township of Newtown"" (4)",1,1,0,0,0,0,"Rights Of Nature|Personhood","CELDF; residents",0,1,1,0,0,0,"NGO|Civil Society","Natural communities and ecosystems","All Nature",,1,3,2,"Newtown Township, Pennsylvania drafted an ordinance recognizing the rights of nature and banning certain types of land development in the township in 2008.",https://ecojurisprudence.org/initiatives/newtown-township-comprehensive-plan-ordinance/
24,"Ecuador court case: rights of the Tangabana páramo",-1.6659954,-78.6992191,EC|Ecuador,"Chimborazo Province, Ecuador","Latin America","Court Case",Submitted,2014,,,Failed,2015,,,,,,,,,,2014,"""The importance of the páramo is paramount, the soils of the páramo are rich in carbon, they are organic soils that help in the water catchment, on the other hand there are also species of animals and plants that do not exist in any other part of the Ecuador, this is because the plants have adapted to cold and altitude, however, all these characteristics and this importance of the páramo are being threatened, the rights of nature, of the páramo are being threatened"" (Page 5 of first judgement).",1,0,0,0,1,0,"Rights Of Nature|Indigenous Model","Environmental activists (Yasunidos Chimborazo, Acción Ecológica) & indigenous pastorate of Chimborazo",1,0,1,0,0,0,"Indigenous|Civil Society","Tangabana páramo",Grassland|Mountain,1,0,0,0,"Judges denied a 2014 lawsuit in Ecuador claiming the actions of the private company ERVIC S.A. violated rights of nature and rights of defenders of nature.",https://ecojurisprudence.org/initiatives/pine-plantation-in-tangabana/
25,"Packer Township (USA) Ordinance: sewage sludge and rights of nature",40.9000,-75.8883,US|USA,"Pennsylvania, USA","North America",Legislation,Approved,2008,,,Failed,2012,,,,,,,,,,2008,"""Natural communities and ecosystems, including, but not limited to, wetlands, streams, rivers, aquifers, and other water systems, possess inalienable and fundamental rights to exist and flourish within the Township of Packer"" (Page 6).",1,1,0,0,0,0,"Rights Of Nature|Personhood","Board of supervisors in Packer Township",0,0,0,0,1,0,Government,"Natural Communities and ecosystems","All Nature",,1,3,2,"Supervisors repealed a 2008 Packer Township, Pennsylvania ordinance recognizing rights of nature and banning the corporate land application of sewage sludge.",https://ecojurisprudence.org/initiatives/packer-township-local-control-sewage-sludge-and-chemical-trespass-ordinance/
27,"Santa Cruz (USA) Ordinance: local control, pesticide and chemical trespass",36.9741,-122.0308,US|USA,"California, USA","North America",Legislation,Drafted,2009,,,,,,,,,,,,,,2009,"""Rights of Natural Communities. Natural communities and ecosystems, including, but not limited to, wetlands, streams, rivers, aquifers, and other water systems, possess inalienable and fundamental rights to exist and flourish within the City of Santa Cruz"" (Page 4).",1,0,0,0,0,0,"Rights Of Nature","CELDF; People Against Chemical Trespass",0,1,1,0,0,0,"NGO|Civil Society","Natural community and ecosystems","All Nature",,1,3,2,"CELDF drafted an ordinance for Santa Cruz, California recognizing rights of nature and residents’ right to be free from chemical trespass in 2009.",https://ecojurisprudence.org/initiatives/the-city-of-santa-cruz-local-control-pesticide-and-chemical-trespass-ordinance/
28,"Shapleigh (USA) Ordinance: community water rights and rights of nature",43.5406,-70.8481,US|USA,"Maine, USA","North America",Legislation,Approved,2009,,,,,,,,,,,,,,2009,"""Natural communities and ecosystems possess unalienable and fundamental rights to exist, flourish, and naturally evolve within the Town of Shapleigh"" (Page 1).",1,1,0,0,0,0,"Rights Of Nature|Personhood","Protecting Our Water and Wildlife Resources in Shapleigh and Newfield",0,0,1,0,0,0,"Civil Society","Water; Natural community and ecosystems","All Nature",,1,3,2,"Shapleigh, Maine passed an ordinance recognizing rights of nature and banning corporate mining of water in response to Nestle’s potential water mining in 2009.",https://ecojurisprudence.org/initiatives/shapleigh-water-rights-and-local-self-government-ordinance/
29,"Newfield (USA) Ordinance: community water rights and rights of nature",43.6481,-70.8470,US|USA,"Maine, USA","North America",Legislation,Approved,2009,,,,,,,,,,,,,,2009,"""Natural communities and ecosystems possess unalienable and fundamental rights to exist, flourish, and naturally evolve within the Town of Newfield"" (Page 1).",1,1,0,0,0,0,"Rights Of Nature|Personhood","Protecting Our Water and Wildlife Resources in Shapleigh and Newfield",0,0,1,0,0,0,"Civil Society","Natural community and ecosystems","All Nature",,1,3,2,"Newfield, Maine passed an ordinance giving nature personhood and banning corporate mining of water in response to Nestle’s potential water mining in 2009.",https://ecojurisprudence.org/initiatives/newfield-water-rights-and-local-self-government-ordinance/
30,"Van Etten (USA) Ordinance: community water rights and rights of nature",42.1987,-76.5524,US|USA,"New York, USA","North America",Legislation,Approved,2009,,,,,,,,,,,,,,2009,"""Rights of Natural Communities Natural communities and ecosystems...possess inalienable and fundamental rights to exist, flourish and naturally evolve within Van Etten"" (Page 2).",1,0,0,0,0,0,"Rights Of Nature","People of Van Etten",0,0,1,0,0,0,"Civil Society","Natural community and ecosystems","All Nature",,1,3,2,"Van Etten, New York passed an ordinance recognizing rights of nature and banning corporate mining of water in 2009.",https://ecojurisprudence.org/initiatives/van-etten-community-water-rights-and-self-government-ordinance/
32,"Blaine Township (USA) Home Rule Charter (2009)",40.1850,-80.3993,US|USA,"Pennsylvania, USA","North America",Legislation,Approved,2009,,,,,,,,,,,,,,2009,"""Rights of Natural Communities Natural communities and ecosystems...possess inalienable and fundamental rights to exist, flourish and naturally evolve within Blaine Township"" (Page 2).",1,1,0,0,0,0,"Rights Of Nature|Personhood","People of Blaine Township",0,0,1,0,0,0,"Civil Society","Natural communities and ecosystems","All Nature",,0,0,0,"Blaine Township in Pennsylvania adopted a charter recognizing rights of nature and refusing to recognize any private claim to ownership of nature in 2009.",https://ecojurisprudence.org/initiatives/blaine-township-charter/
33,"Philippines Court Case: Resident Marine Mammals of Tañon Strait v. Secretary Angelo Reyes",14.5995,120.9842,PH|Philippines,Philippines,Asia,"Court Case",Submitted,2007,,,Approved,2015,,,,,,,,,,2007,"""They are joined by Gloria Estenzo Ramos (Ramos) and Rose-Liza Eisma-Osorio (Eisma-Osorio) as their legal guardians and as friends (to be collectively known as “the Stewards”) who allegedly empathize with, and seek the protection of, the aforementioned marine species"" (page 2).",1,0,1,0,0,0,"Rights Of Nature|Animal Rights","Gloria Estenzo Ramos (Ramos) and Rose-Liza Eisma-Osorio (Eisma-Osorio)",0,0,1,0,0,0,"Civil Society","Marine mammals in the Tañon Strait","Animal|Marine Ecosystem",1,0,0,0,"In 2015  a lawsuit was filed on behalf of ""marine mammals"" against oil exploration in the Tañon Straits in the Philippines claiming it reduced fish populations",https://ecojurisprudence.org/initiatives/resident-marine-mammals-of-the-protected-seascape-tanon-strait-v-secretary-angelo-reyes/
