581,"He Whakaputanga Moana (Whale Protection and Legal Personhood Declaration)",-21.236204,-159.8798082,INT|International,"Pacific Island Nations",Oceania,"Indigenous Declaration",Approved,2024,,,,,,,,,,,,,,2024,"recognizes whales as legal persons with inherent rights, including the right to freedom of movement, a healthy environment, and the ability to thrive alongside humanity. It draws upon the traditions of Te Ao Māori (Māori worldview) and emphasizes the interconnectedness of all living things. Recognizing the urgent threats whales face from unsustainable practices, pollution, and climate change, the declaration outlines a comprehensive plan for their protection. He Whakaputanga Moana aims to establish marine protected areas and implement rāhui (customary restrictions guided by ancestral wisdom). The declaration also advocates for weaving together mātauranga Māori (Indigenous knowledge) with science for a more holistic approach to whale protection. The declaration emphasizes the crucial role of Polynesian communities as kaitiaki (guardians) and proposes the creation of the Hinemoana Halo Ocean Protection Fund that will empower Indigenous communities as the natural guardians, and support initiatives aligned with the declaration’s goals.",1,1,0,0,1,0,"Indigenous Model|Rights Of Nature|Personhood","Hinemoana Halo Ocean Initiative; Maori and Pacific Indigenous leaders",1,0,0,0,0,0,Indigenous,"tohorā (whales)","Animal|Marine Ecosystem",1,1,3,1,"In March 2024, Pacific Indigenous leaders ratified the He Whakaputanga Moana (Declaration for the Ocean), which recognizes whales as legal persons with rights.",https://ecojurisprudence.org/initiatives/he-whakaputanga-moana-declaration-for-the-ocean-treaty/
582,"Minnesota (USA) State Resolution: rights of manoomin",44.9548225,-93.1070813,US|USA,"Minnesota, USA","North America",Declaration,Submitted,2024,,,,,,,,,,,,,,2024,"""A resolution recognizing Wild Rice (Manoomin in Anishinaabe and Psíŋ in Dakota and herein referred as Manoomin/Psíŋ) as sacred and central to the culture and health of Indigenous Peoples in Minnesota and critical to the health and identity of all Minnesota citizens and ecosystems; and establishing a commitment to passing Rights of Manoomin/Psíŋ legislation to protect wild rice and the freshwater resources upon which it depends""",1,0,0,0,1,0,"Rights Of Nature|Indigenous Model","Representative Jamie Becker Finn & Senator Mary Kunesh; Minnesota Interfaith Power & Light (NGO); Rise & Repair alliance",0,1,1,0,1,0,"Government|NGO|Civil Society","Manoomin / Psíŋ (Wild Rice)","Freshwater Ecosystem|Plant",1,0,0,0,"On April 4, 2024, a resolution was introduced in Minnesota state legislature to recognize the inherent rights of Manoomin/Psíŋ (Wild Rice).",https://ecojurisprudence.org/initiatives/minnesota-resolution-for-the-rights-of-manoomin-psin/
583,"India Supreme Court Case: State of Telangana v. Mohd. Abdul Qasim",28.5273522,77.2089851,IN|India,"Telangana State, India",Asia,"Court Case",Approved,2024,,,Failed,2021,,Approved,2018,,,,,,,2018,"“The time has come for mankind to live sustainably and respect the rights of rivers, lakes, beaches, estuaries, ridges, trees, mountains, seas and air. It is imperative to do so as there is always a constant threat to forests due to the ever increasing population. Man is bound by nature’s law. Therefore, the need of the hour is to transform from an anthropocentric approach to ecocentric approach which will encompass a wider perspective in the interest of the environment.” (pg. 32)",1,0,0,0,0,0,"Rights Of Nature","Justice (J. M.M. Sundresh)",0,0,0,0,0,1,Court,"Nature; Forests",Forest,1,0,0,0,"In 2024, an Indian Supreme Court considered ecocentrism, rights to nature and climate change in a ruling in favor of a protected forest in Kompally.",https://ecojurisprudence.org/initiatives/india-supreme-court-case-ruling-in-the-state-of-telangana-v-mohd-abdul-qasim-considering-the-rights-of-nature/
584,"Mexico State (Mexico) Constitutional Amendment: rights of nature",19.2814266,-99.7045025,MX|Mexico,"Mexico State, Mexico","Latin America",Constitution,Approved,2024,,,,,,,,,,,,,,2024,"""In the State of Mexico, Nature or biodiversity, endemic and native species are subjects of rights, which are granted, protected and promoted by the Constitution and the laws of the State of Mexico, at the same level as human rights.” (Article 5)",1,0,0,0,0,0,"Rights Of Nature","Deputy Max Agustín Correa Hernández (Morena Party)",0,0,0,0,1,0,Government,Nature,"All Nature",,2,1,0,"In April 2024, the State of Mexico approved an amendment to its local Constitution recognizing the rights of nature and biodiversity.",https://ecojurisprudence.org/initiatives/state-of-mexico-mexico-constitutional-amendment-recognizing-rights-of-nature/
585,"Germany court case: seals in the North Sea (1988)",53.558572,9.9278215,DE|Germany,"Hamburg, Germany",Europe,"Court Case",Failed,1988,,,,,,,,,,,,,,1988,"""The animal is therefore still a thing in the sense of civil and administrative law; it is not somehow elevated to legal personality."" The seals' ""existential need to survive"" was the starting point for the lawsuit: because it is ""about the continued existence of an entire animal species"".",1,0,1,0,0,0,"Rights Of Nature|Animal Rights","Students of Hamburg",0,0,1,0,0,0,"Civil Society","Seals in the North Sea","Animal|Marine Ecosystem",1,0,0,0,"In 1988, for the first time, ""seals in the North Sea"" sued the Federal Republic of Germany over dumping of toxic waste in the North Sea.",https://ecojurisprudence.org/initiatives/germany-court-case-on-behalf-of-seals-in-the-north-sea-1988/
587,"Sounds Right (International) music initiative: nature as an official artist",40.7493281,-73.9679241,INT|International,International,International,"Private Sector Governance",Approved,2024,,,,,,,,,,,,,,2024,"""SOUNDS RIGHT IS A GROUNDBREAKING MUSIC MOVEMENT. IT UNITES PEOPLE AROUND THE WORLD IN A SHARED COMMITMENT, RECOGNIZING THE INTRINSIC VALUE OF NATURE. TOGETHER, WE MUST ACT NOW TO PROTECT OUR PLANET FOR OUR COMMON FUTURE."" (Melissa Fleming, UN Under-Secretary-General for Global Communication)...""NATURE’s royalties and donations will be collected by EarthPercent, a registered charity in England and Wales (1188391) and a registered 501(c)3 nonprofit foundation in the United States (EIN: 86-3830611). EarthPercent will distribute these funds to rights-based NATURE conservation and restoration projects in the world’s most precious and precarious ecosystems under the guidance of the Sounds Right Expert Advisory Panel, a group of world-leading biologists, environmental activists, Indigenous People’s representatives, and experts in conservation funding. The Panel will consider projects with proven models of ecological and community impact, robust monitoring and evaluation frameworks, and delivered by organisations with the right capabilities. Projects in ecosystems with the highest levels of biodiversity and endemism will be prioritised, with initial analysis identifying Key Biodiversity Areas in the following regions: Madagascar and the Indian Ocean Islands; Indo-Burma, India, and Myanmar; Sundaland; Philippines; Tropical Andes; and, the Atlantic Forest.""",0,0,0,0,0,1,"Eco-Governance System","Sounds Right (Museum for the United Nations – UN Live)",0,0,0,1,0,0,International,Nature,"All Nature",,0,0,0,"In 2024, Nature became recognized as an official artist on streaming platforms, allowing Nature to be officially credited for it's sounds used in recorded music",https://ecojurisprudence.org/initiatives/sounds-right-music-initiative-to-recognize-nature-as-an-official-artist/
588,"Nijmegen (Netherlands) Municipal Motion: rights for nature in the city",51.8428621,5.8331567,NL|Netherlands,"Nijmegen, Netherlands",Europe,Declaration,Failed,2024,,,,,,,,,,,,,,2024,"""the recognition of rights for nature entails a society in harmony with nature, where people and nature form one inseparable whole with the ecosystem; Granting legal personality to nature can improve attention to and protection of our natural environment and stimulate innovative approaches to sustainability""",1,1,0,0,0,0,"Rights Of Nature|Personhood","Eline Lauret (Partij voor de Dieren)",0,0,0,0,1,0,Government,Nature,"All Nature|Urban",1,0,0,0,"In April 2024, a 'Rights for Nature' motion was submitted to the Nijmegen city council in the Netherlands to recognize rights and legal personality for Nature.",https://ecojurisprudence.org/initiatives/nijmegen-netherlands-motion-for-the-rights-of-nature/
589,"North Carolina State (USA) Law: rights of the Dan River ecosystem",35.8215006,-78.7865049,US|USA,"North Carolina, USA","North America",Legislation,Submitted,2024,,,,,,,,,,,,,,2024,"""This act recognizes and protects the rights of the Dan River ecosystem and the right of the people of North Carolina to a healthy, thriving Dan River ecosystem."" (page 1) ""The Dan River ecosystem possesses rights, including, but not limited to, all of the following: (1) The right to naturally exist, flourish, regenerate, and evolve. (2) The right to full restoration, recovery, and preservation. (3) The right to abundant, pure, clean, unpolluted water, including the right to natural surface water flow and recharge and groundwater recharge (4) The right to a healthy natural environment and natural biodiversity. (5) The right to carry on all natural functions of the Dan River ecosystem. (6) The right to be free of activities, practices, and any other man-made obstructions that interfere with or infringe upon the rights set forth in this section. (page 2)",1,0,0,0,0,0,"Rights Of Nature","Representative Pricey Harrison; 7 Directions of Service (NGO)",1,1,0,0,1,0,Government|NGO|Indigenous,"Dan river","Freshwater Ecosystem",1,3,3,0,"May 1, 2024, a bill was introduced in North Carolina’s state legislature to grant legal rights to the Dan River, including the right to be free from pollution.",https://ecojurisprudence.org/initiatives/north-carolina-u-s-rights-of-the-dan-river-ecosystem-act/
590,"Finland citizens’ initiative: constitutional proposal for animal rights",60.1559838,24.6245458,FI|Finland,Finland,Europe,Constitution,Submitted,2023,,,,,,,,,,,,,,2023,"""Animals have legal standing"" (Section 1). ""Public authorities must safeguard the realisation of fundamental animal rights and develop society in a way, which guarantees the fundamental rights of animals. Companies must respect fundamental animal rights in their activities"" (Section 2). ""A wild animal has the right to life and the right to live in freedom, in the animal’s natural habitat"" (Section 3).",1,1,1,0,0,0,"Rights Of Nature|Personhood|Animal Rights","Finnish Association of Animal Rights Lawyers (NGO); citizens of Finland",0,1,1,0,0,0,"NGO|Civil Society",Animals,Animal,1,0,3,0,"December 2023, a citizen's initiative was submitted to the Finnish parliament that proposes adding animal rights to Finlands constitution alongside human rights",https://ecojurisprudence.org/initiatives/finland-citizens-initiative-constitutional-amendment-on-animal-rights/
591,"Goiás (Brazil) Municipal Law: rights of the Vermelho River",-15.876695,-50.4100667,BR|Brazil,"Goiás State, Brazil","Latin America",Legislation,Approved,2024,,,,,,,,,,,,,,2024,"Rights of the Vermelho River: To maintain its natural flow and in sufficient quantity to guarantee the health of the ecosystem; To nourish and be nourished by the surrounding forests and endemic biodiversity; To exist with adequate physical and chemical conditions for its ecological balance; To interrelate with human beings through biocultural identification, spiritual practices, leisure, artisanal fishing, agroecology and culture.",1,0,0,0,0,0,"Rights Of Nature","Councilwoman Elenízia da Mata de Jesus (PT)",0,0,0,0,1,0,Government,"Vermelho River","Freshwater Ecosystem",1,3,3,2,"On June 13, 2024, the Goiás City Council in Brazil unanimously approved a bill granting legal rights to the Vermelho River in Brazil.",https://ecojurisprudence.org/initiatives/municipality-of-goias-brazil-law-on-the-rights-of-the-vermelho-river/
592,"Linhares (Brazil) Municipal Law: rights of the waves",-19.6101971,-39.8493824,BR|Brazil,"Espírito Santo State, Brazil","Latin America",Legislation,Submitted,2023,,,Approved,2024,,,,,,,,,,2023," In summary, the waves are entitled to: Maintaining their physical-chemical conditions for ecological balance; Protecting water bodies in the ecosystem to prevent human interference with vital ecological cycles; Foster harmonious interactions with humans through cultural, spiritual, leisure, and ecological practices; Representation by stakeholders with a special connection to the waves' ecological cycle in all relevant public decision-making processes, and support from governmental, community, and civil society groups in public decision-making processes; Integration of traditional knowledge and conservation practices into decision-making while balancing them with scientific approaches; Ensuring accountability and rectification for human-caused damages to their recognized intrinsic rights.",1,1,0,0,0,0,"Rights Of Nature|Personhood","Municipal Council of Linhares; Regencia Surfing Association; MAPAS (NGO)",0,1,1,0,1,0,"Government|Civil Society|NGO","Waves of the Doce River Mouth","Marine Ecosystem",1,3,3,1|2,"In June 2024, the municipal council of Linhares in Brazil approved a bill that recognizes the waves at the mouth of the Doce River as entities with rights.",https://ecojurisprudence.org/initiatives/municipality-of-linhares-brazil-law-on-the-rights-of-the-waves/
593,"Ecuador Court Case: rights of the Machángara River",-0.1897761,-78.5869717,EC|Ecuador,"Pichincha Province, Ecuador","Latin America","Court Case",Approved,2024,,,,,,,,,,,,,,2024,"The court recognized that since the river is alive, it is subject to rights under the Constitution of Ecuador, which establishes that nature possesses a right to protection, promotion, and restoration. The Constitutional Court of Ecuador previously recognized that rivers are protected under Chapter 7 of the Constitution in 2022.",1,0,0,0,0,0,"Rights Of Nature","Cabildo Cívico de Quito; Kitu Kara Indigenous people",1,0,1,0,0,0,"Indigenous|Civil Society","Machángara River","Freshwater Ecosystem|Urban",1,2,1,1,"In July 2024, a court in Ecuador ruled that the Machángara River is a subject of rights and the municipality of Quito has breeched said rights.",https://ecojurisprudence.org/initiatives/ecuador-court-case-on-the-rights-of-the-machangara-river/
594,"International Rights of Nature Tribunal, 12th Local Hearing: Yesah 2024",36.2541895,-79.752818,INT|International,"North Carolina, USA",International,"Civil Society Tribunal",Approved,2024,,,,,,,,,,,,,,2024,"""The Yesah Tribunal recognizes the inherent Rights of Rivers and their ecosystems, the inherent Rights of Indigenous Peoples and the inherent Rights of Nature...10. As Indigenous People, The Yesah Tribunal recognizes that what happens to Mother Earth happens to us all,"" (Page 5)",1,0,0,0,1,0,"Rights Of Nature|Indigenous Model","International Rights of Nature Tribunal; Global Alliance for the Rights of Nature (GARN); 7 Directions of Service; Movement Rights; ",1,1,0,0,0,0,NGO|Indigenous,"Haw River Ecosystem","Freshwater Ecosystem",1,0,0,0,"In June 2024, the International Rights of Nature Tribunal held its 12th local hearing, the Yesah Tribunal brought against the Mountain Valley Pipeline (MVP).",https://ecojurisprudence.org/initiatives/local-rights-of-nature-tribunal-yesah-2024/
595,"Brazil Constitutional Amendment: rights of nature",-15.7836241,-47.9609283,BR|Brazil,Brazil,"Latin America",Constitution,Drafted,2024,,,Submitted,2025,,,,,,,,,,2024,"""CHAPTER VI THE RIGHTS OF NATURE, Art. 1 Nature is recognized as a subject of rights and is made up of all living beings, human and non-human, that inhabit it and depend on it for their survival. Art. 2 The beings that make up Nature are recognized with the rights to protect their lives, ecosystems and preservation by promoting the balance of their interrelationships. Art. 3 The ancestral and historical relationship of indigenous peoples and other traditional peoples and communities with the preservation of Nature is recognized, as well as the maintenance of these relationships as a guaranteed right to maintain the ways of life of these populations.""",1,0,0,0,0,0,"Rights Of Nature","Representative Célia Xakriabá",0,0,0,0,1,0,Government,Nature,"All Nature",,0,0,0,"In January 2025, a proposed amendment to the Brazilian Federal Constitution (PEC) was submitted to the National Congress to recognize the Rights of Nature.",https://ecojurisprudence.org/initiatives/brazil-proposed-constitutional-amendment-on-the-rights-of-nature/
596,"Black Mountain (USA) Ordinance: Rights of the Swannanoa River",35.6123401,-82.3349869,US|USA,"North Carolina, USA","North America",Legislation,Drafted,2024,,,,,,,,,,,,,,2024,"""the inherent rights of the Swannanoa River Watershed Ecosystem to thrive, regenerate, and flourish. The land within which the Town of Black Mountain is now chartered is unceded territory of Cherokee and Catawba peoples. We are proposing to codify into law our rights to restore and protect our watershed from the systemic threats and irreparable harm to its ecological integrity, an approach rooted in Indigenous values which regard land and beings as sacred heritage and living legacy."" (2)",1,0,0,0,0,0,"Rights Of Nature","Katherine Winship; Kevin Jones; Emily Kerscher; Community Environment Legal Defense Fund (CELDF)",0,0,1,0,0,0,"Civil Society","Swannanoa River","Freshwater Ecosystem",1,3,3,2,"In 2024, residents of Black Mountain, North Carolina drafted a proposed amendment to the Town Charter to recognize the rights of the Swannanoa River.",https://ecojurisprudence.org/initiatives/black-mountain-u-s-town-ordinance-for-rights-of-the-swannanoa-river/
597,"Nigeria River Ethiope Rights Act",9.024256,7.449868,NG|Nigeria,Nigeria,Africa,Legislation,Drafted,2019,,,Submitted,2024,,,,,,,,,,2019,"These rights include: the right to flow unimpeded, maintain its natural biodiversity, protection from pollution, restoration when harmed, the right to be heard in court, and the appointment of guardians to enforce its rights.",1,0,0,0,0,0,"Rights Of Nature","River Ethiope Trust Foundation (RETFON); Earth Law Center",0,1,0,0,0,0,NGO,"River Ethiope","Freshwater Ecosystem",1,3,2,2,"In 2019, the Earth Law Center and River Ethiope Trust created the River Ethiope Rights Act – a draft law to grant legal rights for the River Ethiope in Nigeria.",https://ecojurisprudence.org/initiatives/nigeria-river-ethiope-rights-act/
598,"Colombia Law: rights of the Rancheria River",11.2413542,-73.7529408,CO|Colombia,Colombia,"Latin America",Legislation,Approved,2024,,,,,,,,,,,,,,2024,"""The purpose of this Law is to declare the Ranchería River, its basin and its tributaries, as an entity subject to rights for its conservation, maintenance and restoration by the State and with the effective participation of the communities that live in the area of ​​influence of the Ranchería River, in the department of La Guajira."" (1)",1,0,0,1,0,0,"Rights Of Nature|Local Eco Knowledge","Congress of Colombia",0,0,0,0,1,0,Government,"Rancheria River","Freshwater Ecosystem",1,3,3,1|2,"On August 8, 2024, the Congress of Colombia passed a law declaring the Rancheria River a subject of rights.",https://ecojurisprudence.org/initiatives/colombia-law-on-the-rights-of-the-rancheria-river/
599,"Colombia court case: rights of jaguars, macaws, and tropical dry forest",10.7423935,-74.0129471,CO|Colombia,"Sierra Nevada de Santa Marta region, Colombia","Latin America","Court Case",Submitted,2024,,,,,,,,,,,,,,2024,"A new lawsuit asks Colombia to recognize that jaguars, military macaws and the nation’s tropical dry forest have legal rights to “life, health and integrity.”",1,0,1,0,1,0,"Rights Of Nature|Animal Rights|Indigenous Model","Amar Madre Tierra Foundation (NGO)",0,1,0,0,0,0,NGO,"tropical dry forest, jaguars, macaws",Animal|Forest,1,0,0,0,"In July 2024, a lawsuit was filed in Colombian court to recognize the rights of jaguars, macaws, and the nation’s tropical dry forest.",https://ecojurisprudence.org/initiatives/colombia-court-case-on-rights-of-jaguars-macaws-and-tropical-dry-forest/
600,"First Nations and Tribes Treaty: Grizzly Bear Protection",49.5491292,-114.3392479,INT|International,"First Nations of North America","North America","Indigenous Declaration",Approved,2016,,,,,,,,,,,,,,2016,"""The Grizzly: A Treaty of Cooperation, Cultural Revitalization and Restoration""",0,0,0,0,1,0,"Indigenous Model","Piikani Nation Chief and Council of the Blackfoot Confederacy",1,0,0,0,0,0,Indigenous,"Grizzly Bear",Animal,1,2,3,1,"In September 2016, First Nations and Tribes across North America signed a cross-boarder Indigenous Treaty to protect the sacred Grizzly Bear.",https://ecojurisprudence.org/initiatives/indigenous-first-nations-and-tribes-grizzly-bear-treaty/
601,"Rappahannock Tribe Constitution: rights of the Rappahannock River",37.9190087,-77.0449568,US|USA,"Rappahannock Tribal Nation (Virginia, USA)","North America",Constitution,Approved,2024,,,,,,,,,,,,,,2024,"“exist, flourish, regenerate, and evolve.” This includes rights to groundwater recharge, to support healthy habitats for native species, and to maintain natural water flow.",0,0,0,0,1,0,"Indigenous Model","Rappahannock Tribe; Indigenous Conservation Council for the Chesapeake Bay (ICC); Center for Democratic and Environmental Rights (CDER)",1,1,0,0,0,0,Indigenous|NGO,"Rappahannock River","Freshwater Ecosystem",1,3,3,1,"On October 2024, the Rappahannock Tribe in Virginia became the first tribal nation in the U.S. to adopt a Tribal Constitution recognizing the rights of nature.",https://ecojurisprudence.org/initiatives/rappahannock-tribal-constitution-recognizes-the-rights-of-the-rappahannock-river/
602,"Groningen (Netherlands) Initiative Proposal: rights for nature in the city",53.2091264,6.288005,NL|Netherlands,"Groningen, Netherlands",Europe,Policy,Submitted,2024,,,Approved,2025,,,,,,,,,,2024,"""Giving nature a voice can be done in different ways: by giving nature rights, or by appointing a guardian to stand up for nature...This initiative proposal asks to start the discussion about a voice for nature in the Municipality of Groningen and to investigate together with residents for which areas in the municipality this could be a good solution in order to ensure that nature in Groningen can flourish and biodiversity can be strengthened."" (2). ""There are two possibilities, the legal line where a nature area is given legal personality, and a softer line where only a chair is put at the table for a guardian. In the case of legal personality, nature itself can go to court to defend its interests. So not a nature organization, but the nature area itself. A guardian can defend its rights on behalf of nature. A combination of these is also possible."" (5)",1,1,0,0,0,0,"Rights Of Nature|Personhood","Party for the Animals; D66; GroenLinks; Stichting Rechten van de Natuur",0,1,0,0,1,0,Government|NGO,Nature,"All Nature|Urban",,3,3,2,"In May 2025, an initiative proposal was passed in the Municipality of Groningen, Netherlands to investigate whether nature can be granted rights.",https://ecojurisprudence.org/initiatives/municipality-of-groningen-netherlands-initiative-proposal-rights-for-nature/
603,"Erfurt (Germany) Regional Court Case: rights of nature via the EU Charter of Fundamental Rights (first ruling)",50.984283,10.4245525,DE|Germany,"Thuringia State, Germany",Europe,"Court Case",Approved,2024,,,,,,,,,,,,,,2024,"""The Charter provides the comprehensive right of ecological persons to have their existence, preservation and regeneration of their life cycles, structure, functions and development processes respected and protected.” (section 30). ""The recognition of specific rights of ecological persons through the interpretation and application of existing Union law is necessary due to the importance and urgency of the ecological challenges - climate change, species extinction and global littering - and in view of the threat of irreversible damage. The Charter's preamble emphasises responsibility and duties towards other people, the human community and future generations. (Section 32-33)",1,0,0,0,0,0,"Rights Of Nature","Judge Dr Martin Borowsky",0,0,0,0,0,1,Court,Nature,"All Nature",,0,0,0,"In August 2024, the District Court of Erfurt in Germany set a legal precedent by recognizing the rights of nature in a court ruling.",https://ecojurisprudence.org/initiatives/germany-district-court-of-erfurt-ruling-recognizing-rights-of-nature-through-the-charter-of-fundamental-rights-of-the-european-union/
