193,"Menominee Tribe of Wisconsin (USA) Resolution: Rights of the Menominee River",45.0025,-88.6668,US|USA,"Menominee Indian Tribe (Wisconsin, USA)","North America","Indigenous Law",Approved,2020,,,,,,,,,,,,,,2020,"""the Tribe recognizes to protect the Menominee River, it must secure the highest protections for the river through the recognition of the river's inherent and legal rights"" (Page 2).",1,0,0,0,1,0,"Rights Of Nature|Indigenous Model","Menominee Tribal Legislature",1,0,0,0,0,0,Indigenous,"Menominee River","Freshwater Ecosystem",1,0,0,0,"In 2020, the legislature of the Menominee Tribe of Wisconsin adopted a resolution recognizing the rights of the Menominee River.",https://ecojurisprudence.org/initiatives/recognition-of-the-rights-of-the-menominee-river/
194,"Frome (UK) Draft Bye-law: Rights for the River Frome",51.2308,-2.3201,"GB|United Kingdom","Somerset, England",Europe,Legislation,Submitted,2016,,,Failed,2020,,,,,,,,,,2016,"""Rodden Meadow shall have the right to exist, thrive, regenerate, and evolve, and the right to restoration to high or good ecological status."" (Page 4)",1,0,0,0,0,0,"Rights Of Nature","Councilor Peter Macfadyen; Friends of the River Frome",0,1,0,0,1,0,Government|NGO,"The Frome River and Rodden Meadow","Freshwater Ecosystem",1,1,3,2,"In July 2016, a bylaw giving the Frome River and the Rodden Meadow rights and legal personhood was proposed to the town council of Frome, England.",https://ecojurisprudence.org/initiatives/frome-river-and-rodden-meadow/
196,"Romania Law: recognition of dolphins as nonhuman persons",44.4268,26.1025,RO|Romania,Romania,Europe,Legislation,Failed,2014,,,Submitted,2014,,,,,,,,,,2014,"Dolphins in Romania enjoy the following rights: ""the right to life""...""the right to bodily integrity and not to be subjected to acts of cruelty""... ""the right to freedom of movement in the environment of life and not to be captured and held captive for any other purpose is to be treated medically or to be saved from imminent danger""...""the right to be protected in the living environment and not to be deprived of the group or family to which one belongs."" (Page 1)",1,1,1,0,0,0,"Rights Of Nature|Animal Rights|Personhood","MP Remus Cernea",0,0,0,0,1,0,Government,Dolphins,"Animal|Marine Ecosystem",1,0,0,0,"In 2014, the Romanian upper house voted against a bill declaring dolphins as non-human persons with rights.",https://ecojurisprudence.org/initiatives/law-for-the-recognition-of-dolphins-as-nonhuman-persons/
197,"New York (USA) court case: Nonhuman Rights Project v. Breheny",40.7333902,-74.0828185,US|USA,"New York, USA","North America","Court Case",Submitted,2018,,,Failed,2022,,,,,,,,,,2018,"""Autonomous  nonhuman  animals  such  as  Happy  should  have  'the  right  to  liberty protected  by  habeas  corpus'"" (Page 2).",1,1,1,0,0,0,"Rights Of Nature|Personhood|Animal Rights","Nonhuman Rights Project",0,1,0,0,0,0,NGO,"Happy (Elephant)",Animal,1,0,0,0,"In 2022, an appellate judge ruled against a habeous corpus petition on behalf of Happy the elephant, and recognition of Happy's legal personhood and rights.",https://ecojurisprudence.org/initiatives/nonhuman-rights-project-v-breheny/
198,"ʔEsdilagh First Nation (Canada) Law: rights of the Sturgeon River",48.4284,-123.3656,CA|Canada,"Tŝilhqot’in Nation (British Columbia, Canada)","North America","Indigenous Law",Approved,2020,,,,,,,,,,,,,,2020,"""All Authorization holders must, at the holder's expense, take prompt action to remediate and restore the health of ʔElhdaqox for harm caused, directly or indirectly, under Authorization."" (Page 9)",0,0,0,0,1,0,"Indigenous Model","ʔEsdilagh First Nation",1,0,0,0,0,0,Indigenous,"Sturgeon River (ʔElhdaqox or Fraser River)","Freshwater Ecosystem",1,0,0,0,"In 2020, the ʔEsdilagh First Nation, an indigenous group located in British Columbia, adopted a law in order to protect the Sturgeon River.",https://ecojurisprudence.org/initiatives/%ca%94esdilagh-sturgeon-river-law/
200,"Buckingham County U.S. draft ordinance James River Natural Community Bill of Rights",37.5518,-78.5545,US|USA,"Buckingham County, Virginia, USA","North America",Legislation,Drafted,2018,,,,,,,,,,,,,,2018,"""Ecosystems and natural communities within Buckingham County possess the right to naturally exist, flourish, regenerate, evolve, and be restored"" (Page 2).",1,0,0,0,0,0,"Rights Of Nature","Buckingham: We the People (BWTP) (NGO); CELDF (NGO)",0,1,1,0,0,0,"NGO|Civil Society","Natural communities and ecosystems","All Nature",,1,3,2,"In 2018, the community group Buckingham proposed an ordinance recognizing rights of natural communities and ecosystems within Buckingham County, Virginia.",https://ecojurisprudence.org/initiatives/james-river-natural-community-bill-of-rights/
201,"Connecticut (USA) court case: NonHuman Rights Project v. Commerford Zoo",41.7656874,-72.680087,US|USA,"Connecticut, USA","North America","Court Case",Failed,2020,,,Submitted,2017,,,,,,,,,,2017,"""...Beulah, Minnie, and Karen are autonomous beings who live extraordinarily complex emotional, social, and intellectual lives and who possess those complex cognitive abilities sufficient for common law personhood and the common law right to bodily liberty protected by the common law of habeas corpus, as a matter of common law liberty, equality, or both."" (Page 2 of petition)",1,1,1,0,0,0,"Rights Of Nature|Personhood|Animal Rights","NonHuman Rights Project",0,1,0,0,0,0,NGO,"Beulah, Karen, Minnie (Elephants)",Animal,1,0,0,0,"In 2017, the court denied NonHuman Rights Project’s petition to recognize the legal personhood of three elephants, Beulah, Karen and Minnie. ",https://ecojurisprudence.org/initiatives/nonhuman-rights-project-v-commerford-zoo/
202,"Colombia court case: rights of Salamanca Island Park",4.7110,-74.0721,CO|Colombia,Colombia,"Latin America","Court Case",Approved,2020,,,,,,,,,,,,,,2020,"""En consecuencia, se declara a la zona protegida Vía Parque Isla de Salamanca como sujeto de derechos, en razón de lo consignado en las motivaciones."" (Page 38) “Consequently, the protected area Salamanca Island Park is hereby declared to be subject to rights, based on the reasons stated in the grounds.” ",1,0,0,0,0,0,"Rights Of Nature","Luis Miguel Llorente Altamiranda",0,0,1,0,0,0,"Civil Society","Vía Parque Isla Salamanca (VPIS)","All Nature",1,2,1,0,"The Colombian Supreme Court of Justice ultimately granted legal status to the Salamanca Island Parkway and ordered an emergency plan for its restoration.",https://ecojurisprudence.org/initiatives/rights-of-salamanca-island-park-case/
203,"Nez Perce (USA) Tribal Resolution: Rights of the Snake River",46.2916,-116.3760,US|USA,"Nez Perce Tribal Nation (Idaho, USA)","North America","Indigenous Law",Approved,2020,,,,,,,,,,,,,,2020,"""The Nez Perce Tribe recognizes that the Snake River is a living entity that possesses fundamental rights, in accordance with long standing Nez Perce tribal beliefs and practices."" (Page 2)",1,0,0,0,1,0,"Rights Of Nature|Indigenous Model","Nez Perce Tribe",1,0,0,0,0,0,Indigenous,"Snake River","Freshwater Ecosystem",1,0,0,0,"In 2020, Nez Perce Tribe leaders passed a resolution recognizing the rights of Snake River and giving it legal personhood.",https://ecojurisprudence.org/initiatives/snake-river-resolution/
204,"Mexico New General Water Law Amendment: rights of nature",19.4326,-99.1332,MX|Mexico,Mexico,"Latin America",Legislation,Failed,2020,,,,,,,,,,,,,,2020,"""Los habitantes del territorio nacional tienen el derecho de hacer uso de la Naturaleza para su bienestar dentro de los límites ecológicos sin contaminarla o explotarla, y reconocen que: i. Los seres humanos son parte de la Naturaleza, no están separados de ella, y deben esforzarse por vivir en armonía con los ríos, las fuentes de agua y toda la Naturaleza en general; ii. Los Derechos de la Naturaleza inlcuidos los Derechos de los Ríos y otras Fuentes Hídricas, y los Derechos Humanos al Agua, al Saneamiento y a un Medio Ambiente Sano son inseparables; iii. La Naturaleza es un ser vivo, indivisible, y está conformado por todos sus ecosistemas y especies; y iv. Por lo tanto se reconocen sus derechos como un ente colectivo sujeto de derechos."" (Page 23)",1,0,0,0,0,0,"Rights Of Nature","Earth Law Center",0,1,0,0,0,0,NGO,Water,"Freshwater Ecosystem",1,3,1,0,"In 2020, the Chamber of Deputies rejected amendments to the draft bill of the New General Water Law of Mexico adding the recognition of rights of nature.",https://ecojurisprudence.org/initiatives/proposal-for-mexicos-new-general-water-law/
205,"El Salvador Law: Rights of the Lempa River",13.6929,-89.2182,"SV|El Salvador","El Salvador","Latin America",Legislation,Drafted,2020,,,,,,,,,,,,,,2020,"""1. Declara que el Río Lempa tiene derecho a los principios fundamentales expuestos en esta Declaración, que surgen de su propia existencia en nuestro planeta común; 2. Declara además que el Río Lempa es una entidad viviente que posee derecho de acceso a la justicia; 3. Establece que el Río Lempa deberá tener como mínimo los siguientes derechos fundamentales: (1) El derecho al flujo; (2) El derecho a ejercer sus funciones esenciales con el ecosistema; (3) El derecho a estar libre de toda contaminación; (4) El derecho a alimentar y ser alimentado por sus afluentes; (5) El derecho a la biodiversidad nativa; y, (6) El derecho a la regeneración y restauración."" (Page 3) ""1. Declares that the Lempa River has the right to the fundamental principles set forth in this Declaration, which arise from its very existence on our shared planet; 2. Further declares that the Lempa River is a living entity that has the right to access to justice; 3. Establishes that the Lempa River shall have at least the following fundamental rights: (1) The right to flow; (2) The right to perform its essential functions within the ecosystem; (3) The right to be free from all pollution; (4) The right to feed and be fed by its tributaries; (5) The right to native biodiversity; and, (6) The right to regeneration and restoration.""",1,0,0,0,0,0,"Rights Of Nature",,0,0,0,0,1,0,Government,"Lempa River","Freshwater Ecosystem",1,3,2,1|2,"In 2020, a draft bill aimed to recognize the Lempa River as a subject of law in El Salvador, enabling a caretaking system.",https://ecojurisprudence.org/initiatives/draft-declaration-and-recognition-of-the-rights-of-the-lempa-river-as-a-subject-of-rights-in-el-salvador/
207,"Colombia court case: rights of Los Nevados National Park",4.4447,-75.2424,CO|Colombia,"Tolima Department, Colombia","Latin America","Court Case",Approved,2020,,,,,,,,,,,,,,2020,"""PRIMERO: DECLARAR que el Parque Nacional Natural los Nevados es Sujeto Especial de Derechos para su protección, recuperación y conservación con enfoque integral. Como sujeto declarado, se tutelan los derechos fundamentales del Parque Natural Nacional de los Nevados a la vida, a la salud y a un ambiente sano."" (Page 106)",1,0,0,0,0,0,"Rights Of Nature","Juan Felipe Rodríguez Vargas",0,0,1,0,0,0,"Civil Society","Los Nevados National Park",Grassland|Mountain,1,3,1,0,"In 2020, the Superior Court of the Judicial District of Ibagué declared Los Nevados National Park as a special subject of rights.",https://ecojurisprudence.org/initiatives/los-nevados-national-park/
208,"Colombia court case: rights of the Complejo del Páramo de Las Hermosas",4.4447,-75.2424,CO|Colombia,"Tolima Department, Colombia","Latin America","Court Case",Approved,2020,,,,,,,,,,,,,,2020,"""PRIMERO: DECLARAR que el Complejo de Páramos Las Hermosas es Sujeto Especial de Derechos para su protección, conservación y preservación con enfoque integral. En consecuencia, se tutelan los derechos fundamentales del Complejo de Páramos Las Hermosas a la vida, a la salud y a un ambiente sano, debido a la falta de articulación y coordinación en las acciones adoptadas en beneficio del parque por las entidades nacionales, territoriales y las Corporaciones Autónomas accionadas en cumplimiento de sus deberes de cuidado, mantenimiento y conservación del parque."" (Page 81)",1,0,0,0,0,0,"Rights Of Nature","Juan Felipe Rodríguez Vargas, Daniel Rubio Jiménez",0,0,1,0,0,0,"Civil Society","Complejo de Páramos Las Hermosas","Freshwater Ecosystem|Grassland|Mountain",1,3,1,0,"In 2020, the Superior Court of the Judicial District of Ibagué in Colombia declared Complejo de Páramos ""Las Hermosas"" as a special subject of rights.",https://ecojurisprudence.org/initiatives/complejo-de-paramos-las-hermosas/
211,"El Salvador Proposed Constitutional Amendment to Recognize the Rights of Nature",13.6929,-89.2182,"SV|El Salvador","El Salvador","Latin America",Constitution,Submitted,2021,,,,,,,,,,,,,,2021,"""Nature is also recognized as a subject of rights, since it generates, reproduces and realizes life. Recognized rights include the right to full respect for Nature's existence, the maintenance and regeneration of its vital cycles, structure, functions and evolutionary processes."" (page 6)",1,0,0,0,0,0,"Rights Of Nature","Movimiento Político Rebelión Verde El Salvador (ReverdES)",0,0,1,0,0,0,"Civil Society",Nature,"All Nature",,1,1,0,"A proposal for constitutional reform was presented to the Legislative Assembly of El Salvador to recognize rights of nature at the constitutional level in 2021.",https://ecojurisprudence.org/initiatives/el-salvador-constitutional-amendment-proposal/
212,"EU Parliament Resolution: halt and reverse EU-driven global deforestation",48.5734,7.7521,INT|International,"European Union",Europe,Legislation,Approved,2020,,,,,,,,,,,,,,2020,"""...while forests and biodiversity also have an intrinsic value beyond their use value to humans, including as carbon stocks, which cannot be monetised or quantified; I. whereas forests have cultural, social and spiritual value for many people and peoples;""(Page 6)...and...""Believes that ancient and primary forests should be considered and protected as global commons, and that their ecosystems should be granted a legal status."" (Page 19)",0,0,0,0,0,1,"Eco-Governance System","European Parliament",0,0,0,1,0,0,International,Forests,Forest,1,0,0,0,"In 2020, the EU Parliament passed a resolution addressing deforestation and the protection of forests in order to restore their biodiversity.",https://ecojurisprudence.org/initiatives/european-union-parliament-legal-status-of-ecosystems/
213,"Orange County (USA) Ordinance: rights of the Wekiva and Econlockhatchee Rivers",28.4845,-81.2519,US|USA,"Florida, USA","North America",Legislation,Approved,2020,,,,,,,,,,,,,,2020,"""The Wekiva River and Econlockhatchee River, portions of which are within the boundaries of Orange County, and all other Waters within the boundaries of Orange County, have a right to exist. Flow, to be protected against Pollution and to maintain a healthy ecosystem."" (Page 1)",1,0,0,0,0,0,"Rights Of Nature","CELDF; Speak Up Wekiva; Eugene Stoccardo (member of the charter review commission)",0,1,1,0,0,0,"NGO|Civil Society","Wekiva River and Econlockhatchee River","Freshwater Ecosystem",1,1,3,2,"In 2020, Orange County, Florida adopted a charter amendment recognizing the Wekiva River and Econlockhatchee River have rights.",https://ecojurisprudence.org/initiatives/wekiva-and-econlockhatchee-river-bill-of-rights-right-to-clean-water-charter-amendment/
214,"Argentina National Rights of Nature Law",-34.6037,-58.3816,AR|Argentina,Argentina,"Latin America",Legislation,Submitted,2020,,,,,,,,,,,,,,2020,"""La Naturaleza, o Pachamama, donde se reproduce y realiza la vida, tiene derecho a que se respete integralmente su existencia y el mantenimiento y regeneración de sus ciclos y funciones vitales, estructura y procesos evolutivos"" (page 1)",1,0,0,0,0,0,"Rights Of Nature","Leonardo Grosso, member of the Argentine Chamber of Deputies for Buenos Aires Province",0,0,0,0,1,0,Government,Nature,"All Nature",,1,3,2,"In 2020, the Rights of Nature Law was reintroduced to the House of Representatives with the support of the Global Alliance for Rights of Nature.",https://ecojurisprudence.org/initiatives/argentinian-rights-of-nature-law/
215,"Oaxaca State (Mexico) Constitutional Amendment: rights of nature",17.0732,-96.7266,MX|Mexico,"Oaxaca State, Mexico","Latin America",Constitution,Submitted,2020,,,Approved,2021,,,,,,,,,,2020,"""Los Derechos de la Naturaleza son: la preservación, la protección de los elementos que la conforman, a ejercer sus ciclos naturales y vitales y sus funciones ecológicas, a la restauración integral del equilibrio ecológico y a ser legalmente representadas"". Estos derechos integral deberán de su ser equilibrio garantizados ecológico por y las aautoridades del Estado de Oaxaca, en el ámbito de sus competencias"" (Page 9)",1,0,0,0,0,0,"Rights Of Nature","Deputies Fredie Delfin Avendaño and Horacio Soza Villavicencio in partnership with Claudia Brindis and Grant Wilson from Earth Law Center Mexico",0,1,0,0,1,0,Government|NGO,Nature,"All Nature",,0,0,0,"In April 2021, the State of Oaxaca passed a state constitutional amendment recognizing the Rights of Nature.",https://ecojurisprudence.org/initiatives/oaxaca-constitution-rights-of-nature/
216,"Santa Fe Province (Argentina) Law: rights of nature",-31.6107,-60.6973,AR|Argentina,"Santa Fe Province, Argentina","Latin America",Legislation,Submitted,2020,,,,,,,,,,,,,,2020,"""La Naturaleza, donde se reproduce y realiza la vida, tiene derecho a que se respete integralmente su existencia y el mantenimiento y regeneración de sus ciclos y funciones vitales, estructura y procesos evolutivos."" (Page 1)",1,0,0,0,0,0,"Rights Of Nature","Carlos del Frade, Provincial Deputy",0,0,0,0,1,0,Government,Nature,"All Nature",,1,3,2,"In 2020, Representative Carlos del Frade submitted a Rights of Nature bill for the Santa Fe province in Argentina to achieve harmony with nature.",https://ecojurisprudence.org/initiatives/santa-fe-bill-on-the-rights-of-nature/
217,"Colombia court case: rights of Lago de Tota",5.4545,-73.3620,CO|Colombia,"Bocayá Province, Colombia","Latin America","Court Case",Approved,2020,,,Failed,2021,,,,,,,,,,2020,"""SEGUNDO. – DECLARAR que el Lago de Tota y su cuenca hidrográfica, ostenta la calidad de sujeto de derechos a la protección, conservación, mantenimiento y restauración a cargo del Estado, en cabeza del Ministerio del Medio Ambiente y Desarrollo Sostenible, de conformidad con los argumentos expuestos en este proveído."" (Page 71)",1,0,0,0,0,0,"Rights Of Nature","Judge Adriana Fernanda Guasguita Galindo",0,0,0,0,0,1,Court,"Lake Tota and its watershed","Freshwater Ecosystem",1,2,1,0,"In 2020, the First Civil Court of Sogamoso, Boyacá, Colombia declared Lake Tota and its watershed as rights holders.",https://ecojurisprudence.org/initiatives/lago-de-tota-rights-of-nature-case/
218,"IUCN World Conservation Congress Motion 218: recognizing nature as a subject of law",43.2803453,5.3806484,INT|International,"Marseille, France",International,Declaration,Submitted,2020,,,Failed,2021,,,,,,,,,,2020,"""a) d’évaluer l’impact des droits de la Nature sur la biodiversité et les conditions de vie des populations, spécialement celles qui en sont les plus dépendantes ; b) ... à l’évolution du droit international et des droits internes vers un modèle moins anthropocentrique en promouvant l’octroi d’une personnalité juridique à la Nature en général et à certains de ses éléments en particulier ... c) d’appuyer et de favoriser la création et le développement de formations pertinentes sur les droits de la Nature"" (Pages 1-2).",1,0,0,0,0,0,"Rights Of Nature","Earth Law Center",0,1,0,0,0,0,NGO,Nature,"All Nature",,0,0,0,"Lawyers from the IUCN submitted a motion to formally recognize Rights of Nature at the 2020 IUCN World Conservation Congress.",https://ecojurisprudence.org/initiatives/iucn-rights-of-nature-motion/
219,"Ecuador court case: construction of the Evenezer-Macuma-Taisha highway",-2.18780,-78.6945,EC|Ecuador,"Morona-Santiago Province, Ecuador","Latin America","Court Case",Approved,2017,,,Submitted,2015,,,,,,,,,,2015,"""(...) teniendo en consideración que los informes de la Autoridad Ambiental se refieren únicamente al ambiente sano y su afectación, sin embargo aplicando el principio de precaución cabría hacer referencia a que es probable que los derechos de la naturaleza establecidos en l4 Constitución pudieron haberse visto afectados y que finalmente es necesaria la restauración de área afectada, eso no deja de lado que existen otras garantías que el Estado debe exigir respecta a los responsables como son las medidas de no repetición; puesto que el fin último es de conservar estos sitios que tienen particular importancia para el Estado y para el respeto de lo; ciclos vitales, estructura y funciones de la naturaleza entendida como sujeto de derechos, es necesario que se mantenga la salvaguardia necesaria de toda actividad que provoque el detrimento del ecosistema."" (Page 15 of Defensoria del Pueblo Report)",1,0,0,0,0,0,"Rights Of Nature","Ecuador's Ministry of Environment",0,0,0,0,1,0,Government,"Macuma-Macuma and Taisha rivers, Katuku-Shaimi Forest","All Nature",1,0,0,0,"In 2011, an Ecuador court halted the Provincial Government of Morona Santiago from constructing a highway, declaring it violated rights of nature.",https://ecojurisprudence.org/initiatives/evenecer-macuma-taisha-road-project/
220,"Ecuador Organic Code of the Environment",-0.1807,-78.4678,EC|Ecuador,Ecuador,"Latin America",Legislation,Approved,2017,,,,,,,,,,,,,,2017,"""Article 1.- Purpose. The purpose of this Code is to guarantee the right of people to live in a healthy and ecologically balanced environment, as well as to protect the rights of nature for the realization of good living or sumak kawsay."" (Page 8)",1,0,0,0,0,0,"Rights Of Nature","Ecuadorian National Assembly",0,0,0,0,1,0,Government,Nature,"All Nature",,0,0,0,"The Organic Code on the Environment of Ecuador was published in 2017, guaranteeing environmental rights and rights of nature as recognized in the constitution.",https://ecojurisprudence.org/initiatives/ecuadors-organic-code-of-the-environment/
221,"Ecuador court case: Llurimagua copper mine in the Intag Cloud Forest",0.361859,-78.62642,EC|Ecuador,"Imbabura Province, Ecuador","Latin America","Court Case",Submitted,2020,,,Approved,2023,,,,,,,,,,2020,"""the constitutional rights of nature have been violated, protected in the Constitution of the Republic, in Arts. 71 and 73."" (Page 1)",1,0,0,0,0,0,"Rights Of Nature","Andrea Terán Valdez (plaintiff); DECOIN, GARN, CEDENMA",1,1,1,0,0,0,"NGO|Civil Society|Indigenous","Ecosystems in the concession area in Llurimagua",Animal|Forest,1,0,0,0,"In 2020, a judge in Ecuador ordered the suspension of activities related to the Llurimagua mining concession due to imminent violations of rights of nature.",https://ecojurisprudence.org/initiatives/llurimagua-mining-case/
222,"Florianópolis (Brazil) Organic Law: rights of nature",-27.5948,-48.5569,BR|Brazil,"Santa Catarina State, Brazil","Latin America",Legislation,Approved,2019,,,Submitted,2018,,,,,,,,,,2018,"Rights of Nature",1,0,0,0,0,0,"Rights Of Nature","Municipality of Florianopolis, Mapas (NGO)",0,1,0,0,1,0,Government|NGO,Nature,"All Nature|Urban",,0,0,0,"In 2019, the city of Florianopolis in Brazil approved an amendment stating it is responsible for promoting diversity and harmony with nature.",https://ecojurisprudence.org/initiatives/florianopolis-organic-law-133/
223,"Paudalho (Brazil) Municipal Ordinance: San Severino Ramos Natural Water Spring",-8.0817217,-35.5008775,BR|Brazil,"Pernambuco State, Brazil","Latin America",Legislation,Approved,2018,,,,,,,,,,,,,,2018,"Local law declares the San Severino Ramos Natural Water Spring as a natural, environmental and cultural heritage - necessary to ensure the right to an ecologically healthy and balanced environment with the maintenance of ecosystem processes necessary for the quality of life",0,0,0,0,0,1,"Eco-Governance System","Mayor of Paudalho",0,0,0,0,1,0,Government,"San Severino Ramos Natural Water Spring","Freshwater Ecosystem",1,0,0,0,"In 2018, Paudalho, Brazil passed an ordinance recognizing the Fonte de Agua Mineral as part of a natural, environmental and cultural heritage.",https://ecojurisprudence.org/initiatives/the-san-severino-ramos-natural-water-spring/
224,"Universal Declaration of the Rights of Mother Earth",-17.3346,-66.2159,INT|International,International,International,"Civil Society Declaration",Drafted,2010,Ongoing,,,,,,,,,,,,,2010,"""Mother Earth and all beings of which she is composed have the following inherent rights..."" and ""Every human being is responsible for respecting and living in harmony with Mother Earth."" (Page 4)",1,0,0,0,0,0,"Rights Of Nature","President Evo Morales Ayma of Bolivia",1,1,1,1,1,0,"International|Government|Indigenous|NGO|Civil Society","Mother Earth","All Nature",,0,0,0,"In 2010, the Universal Declaration of Rights of Mother Earth was presented at the First Peoples Conference on Climate Change and the Rights of Mother Earth.",https://ecojurisprudence.org/initiatives/universal-declaration-of-the-rights-of-mother-earth/
225,"The Earth Charter",9.9281,-84.0907,INT|International,International,International,"Civil Society Declaration",Approved,2000,,,,,,,,,,,,,,2000,"""Recognize that all beings are interdependent and every form of life has value regardless of its worth to human beings."" (Page 2)",0,0,0,0,0,1,"Eco-Governance System","Earth Charter Commission",0,1,1,1,1,0,"International|NGO|Civil Society|Government",Earth,"All Nature",,0,0,0,"In 2000, the Earth Charter Commission launched the Earth Charter at the Peace Palace in The Hague.",https://ecojurisprudence.org/initiatives/the-earth-charter/
