408,"Ecuador court case: mining in Piñas Canton",-0.1807,-78.4678,EC|Ecuador,"El Oro Province, Ecuador","Latin America","Court Case",Approved,2021,,,,,,,,,,,,,,2021,"""...declares the violation of the consitutional right of nature to the comprehensive respect for their existence, the maintenance and regeneration of their life cycles, and the right of the communities ""La Mesa"" and ""El Pórtete,"" and of the people to the goodlive, water and a healthy environment..."" (Page 16 of first judgement).",1,0,0,0,0,0,"Rights Of Nature","Liliana Maribel Ramírez Sánchez, representative of the group ""nature and future generations;"" Rosa Magaly Aguilar Ayala, representative of the Pórtete community; and Manuel Jesús Quizhpilema Paguay representative of the subject of the rights of nature Cerro ""La Chuya"" and the environmental group Yasunidos Piñas.",0,1,1,0,0,0,"NGO|Civil Society","La Chuya","All Nature",1,0,0,0,"The court approved declared mining activities violated the rights of nature along with the rights of the communities ""La Mesa"" and ""El Pórtete.""",https://ecojurisprudence.org/initiatives/mining-in-the-pinas-canton/
409,"Ecuador Constitutional Court Case: rights of the Dulcepamba River",-0.1807,-78.4678,EC|Ecuador,"Bolívar Province, Ecuador","Latin America","Court Case",Submitted,2013,,,Failed,2014,,Submitted,2019,,,,,,,2013,"""I know Has made to nature already the community in the reports issued by all these entities istatales from the year 2015, the company hydroelectric HIDROTAMBO has not complied with what I know it has requested and the state entities they have not given the correct follow-up, incurring on a omission by the State that would result in the violation of the rights of nature and of the people who they live in the community of San Pablo de Amali"" (Page 1 of Constitutional Court Selection).",1,0,0,0,0,0,"Rights Of Nature","Community of San Pablo de Amalí; Ombudsman's Office; Ecumenical Human Rights Commission (CEDHU)",1,1,1,0,1,0,"NGO|Civil Society|Government|Indigenous","Dulcepamba River","Freshwater Ecosystem",1,0,0,0,"In 2019, a case on rights of nature violations to the Dulcepamba river by the San José de Tambo hydroelectric company was selected by the Constitutional court.",https://ecojurisprudence.org/initiatives/san-jose-del-tambo-hydroelectric-project/
410,"Ecuador Constitutional Court Case: Tigre River treatment plant in Mera Canton",-0.1807,-78.4678,EC|Ecuador,"Pastaza Province, Ecuador","Latin America","Court Case",Submitted,2011,,,Approved,2015,,,,,,,,,,2011,"""Se advierte que la Sala Única de la Corte Provincial de Justicia de Pastaza no efectuó la correspondiente verificación de si existió o no vulneración de los derechos
constitucionales expuestos en la decisión impugnada con relación a los hechos fácticos y la normativa jurídica aplicable al caso concreto, debido a que la sentencia se limitó, únicamente, a transcribir textualmente los supuestos derechos constitucionales infringidos, entre ellos, los derechos relacionados con el medio ambiente sano y con la naturaleza, pero no efectuó, conforme era exigible, un ejercicio razonable e inteligible que tuviese como finalidad comprobar la forma en que una resolución administrativa que sancionó al Gobierno Autónomo Descentralizado Municipal del cantón Mera por actuar sin el permiso ambiental respectivo, vulneró dichos derechos constitucionales"" (Page 14 Constitutional Court Judgement)",1,0,0,0,0,0,"Rights Of Nature","David Ricardo Salvador Peña (Director of the Ministry of Environment in Pastaza Province)",0,0,0,0,1,0,Government,"Tigre River","Freshwater Ecosystem",1,0,0,0,"In 2015, the Constitutional Court of Ecuador admitted an appeal for protection regarding the expansion of a drinking water project.",https://ecojurisprudence.org/initiatives/del-rio-tigre-treatment-plant/
411,"Ecuador Constitutional Court Case: Escazú Agreement",-0.1807,-78.4678,EC|Ecuador,Ecuador,"Latin America","Court Case",Approved,2019,,,,,,,,,,,,,,2019,"""La Constitución de la República reconoce en su artículo 71 a la naturaleza como un sujeto de derechos, y garantiza a toda persona, comunidad, pueblo o nacionalidad la posibilidad de exigir a la autoridad pública el cumplimiento de sus derechos. En ese sentido, establece la obligación del Estado de incentivar a las personas naturales y jurídicas, y a los colectivos, para que protejan la naturaleza, y de promoverel respeto a todos los elementosque forman un ecosistema."" (Page 3).",1,0,0,0,0,0,"Rights Of Nature","Presidency of the Republic of Ecuador",0,0,0,0,1,0,Government,Nature,"All Nature",,0,0,0,"The Constitutional Court of Ecuador decided the Ezcasu Agreement is consistent with constitutional protections for nature and doesn’t need legislative approval.",https://ecojurisprudence.org/initiatives/constitutionality-of-the-escazu-agreement/
413,"Ecuador Administrative Sanction: Secoya Nation (cutting native forest to plant palm)",-0.1807,-78.4678,EC|Ecuador,"Secoya Nation (Sucumbios, Ecuador)","Latin America",Policy,Approved,2011,,,,,,,,,,,,,,2011,"Rights of nature",1,0,0,0,0,0,"Rights Of Nature","Ecuadorian Ministry of Environment",0,0,0,0,1,0,Government,"Native forest",Forest,1,0,0,0,"Ecuador’s Ministry of Environment fined Secoya group for cutting native forest, citing this as a violation of rights of nature.",https://ecojurisprudence.org/initiatives/palm-plantation-secoyas/
414,"Ecuador court case: oil exploitation in Yasuní National Park",-0.6225691,-76.0867555,EC|Ecuador,Ecuador,"Latin America","Court Case",Submitted,2005,,,Approved,2008,,,,,,,,,,2005,"""CUARTA.- La práctica de actividades industriales, extractivas, agrícolas, realizadas sin preocupación por los efectos que sobre el ambiente y las personas podrían ocasionar, que han determinado fenómenos alarmantes como el calentamiento global, la erosión de la capa de ozono, el peligro de agotamiento de recursos renovables y no renovables, la desertificación de la tierra, entre otros y la consecuente afectación al ambiente y la vida de los seres vivos y fundamentalmente de los seres humanos, determinó que la comunidad internacional, a través de diversos instrumentos, adoptara principios de política de protección del medio ambiente que los Estados y la sociedad deberán observar para proteger el ambiente, el que constituye un derecho supranacional, en tanto los factores ambientales sobrepasan las fronteras de los estados, comprometiendo la cooperación internacional"" (Page 3).",0,0,0,0,0,1,"Eco-Governance System","Xavier Guillermo Bustamante Barriga; Silvana del Rocío - Rivadeneira Arcos; Rossana Justina Manosalvas Nicolalde; Sandra Ximena Loor Vela; Jorge Alban Gómez and Edgar Efraín Isch López",0,0,1,0,0,0,"Civil Society","Yasuni National Park",Forest,1,0,0,0,"The Third Chamber of the Constitutional Court decided to suspend PETROBRAS' environmental license for an oil exploitation project in Yasuni National Park.",https://ecojurisprudence.org/initiatives/oil-exploitation-in-yasuni-national-park/
415,"Brazil Ecocide Law 2019",-15.7975,-47.8919,BR|Brazil,Brazil,"Latin America",Legislation,Failed,2019,,,,,,,,,,,,,,2019,"""Art. 1 This Law amends Law No. 9.605, of 12th of February 1998, to typify the crime of ecocide and the criminal conduct of the person responsible for the disaster related to dam break"" (Page 2).",0,0,0,0,0,1,"Eco-Governance System","Federal Deputy Zé Silva",0,0,0,0,1,0,Government,Environment,"All Nature",,0,0,0,"A Brazilian ecocide law submitted by the Federal Deputy Zé Silva and approved by Brazil’s Chamber of Deputies, but not by the Federal Senate.",https://ecojurisprudence.org/initiatives/brazil-ecocide-law/
417,"New Zealand Policy: Te Mana o te Wai (National Policy Statement for Freshwater Management)",-40.9006,174.8860,"NZ|New Zealand","Aotearoa (New Zealand)",Oceania,Policy,Approved,2020,,,,,,,,,,,,,,2020,"""Te Mana o te Wai is a concept that refers to the fundamental importance of water and recognises that protecting the health of freshwater protects the health and well-being of the wider environment. It protects the mauri of the wai. Te Mana o te Wai is about restoring and preserving the  balance between the water, the wider environment,  and the community"" (Page 5).",0,0,0,0,1,0,"Indigenous Model","New Zealand government, including indigenous members",1,0,0,0,1,0,Indigenous|Government,Freshwater,"Freshwater Ecosystem",1,0,0,0,"In 2020, the New Zealand government adopted the National Policy Statement for Freshwater Management to provide updated guidelines about managing freshwater.",https://ecojurisprudence.org/initiatives/te-mana-o-te-wai-under-the-national-policy-statement-for-freshwater-management/
419,"New Zealand Policy: Te Mana o te Taiao (Biodiversity Strategy)",-40.9006,174.8860,"NZ|New Zealand","Aotearoa (New Zealand)",Oceania,Policy,Approved,2020,,,,,,,,,,,,,,2020,"""The vision we set out for this strategy is not only for the return of health to the natural world in a way that we can measure but also for the return of a health and vibrancy that we can feel, touch, smell and hear, as well as an emotional reconnection with nature"" (Page 10).",0,0,0,0,1,0,"Indigenous Model","New Zealand government, including indigenous members",1,0,0,0,1,0,Indigenous|Government,Nature,"All Nature",,0,0,0,"In 2020, the New Zealand government made a strategic framework for protecting, restoring, and sustainably using biodiversity—especially indigenous biodiversity.",https://ecojurisprudence.org/initiatives/te-mana-o-te-taiao-the-aotearoa-new-zealand-biodiversity-strategy-2020/
420,"New Zealand Law: Ngāti Rangi Claims Settlement Act 2019 (rights of the Whangaehu River)",-40.9006,174.8860,"NZ|New Zealand","Aotearoa (New Zealand)",Oceania,Legislation,Approved,2019,,,Submitted,2018,,,,,,,,,,2018,"""Te Waiū-o-Te-Ika is a living and indivisible whole from Te Wai ā-moe to the sea, comprising physical (including mineral) and metaphysical elements, giving life and healing to its surroundings and communities"" (Page 48).",0,0,0,0,1,0,"Indigenous Model","Ngāti Rangi, New Zealand government",1,0,0,0,1,0,Indigenous|Government,"Whangaehu River (Te Waiū-o-Te-Ika)","Freshwater Ecosystem",1,0,0,0,"In 2019, the New Zealand government passed the Ngāti Rangi Claims Settlement Act 2019, which uses an indigenous model and establishes environmental protections.",https://ecojurisprudence.org/initiatives/ngati-rangi-claims-settlement-act-2019/
421,"Blue Mountains (Australia) City Council Declaration: rights of nature",-33.4100,150.3037,AU|Australia,"Blue Mountains, Australia",Oceania,Declaration,Approved,2021,,,,,,,,,,,,,,2021,"""On 29 April 2021 Blue Mountains City Council announced its intention to become the first Council and government entity in Australia to integrate Rights of Nature (RON) principles into its operations and practices"" (Page 1).",1,0,0,0,0,0,"Rights Of Nature","Australian Earth Law Alliance; Blue Mountains City Council",0,1,0,0,1,0,NGO|Government,Nature,"All Nature",,0,0,0,"In 2021, the Blue Mountains City Council became the first council in Australia to incorporate rights of nature principles into its operations and practices.",https://ecojurisprudence.org/initiatives/blue-mountain-city-council-declaration-on-rights-of-nature/
423,"African Commission on Human and Peoples’ Rights Resolution: sacred natural sites and territories",13.4544,-16.5753,INT|International,International,Africa,Declaration,Approved,2017,,,,,,,,,,,,,,2017,"""Calls on States Parties to recognise sacred natural sites and territories, and their customary governance systems, as contributing to the protection of human and peoples’ rights""",0,0,0,1,0,0,"Local Eco Knowledge","The Gaia Foundation; African Biodiversity Network; African Commission on Human and Peoples’ Rights",0,1,1,1,0,0,"NGO|Civil Society|International","Sacred natural sites","All Nature",,0,0,0,"The Gaia Foundation and the African Biodiversity Network made a resolution recognizing sacred sites, territories and their customary governance systems in 2017.",https://ecojurisprudence.org/initiatives/resolution-on-the-protection-of-sacred-natural-sites-and-territories/
424,"Ecuador Constitutional Court Case: 2014 Regulation of Mining Activities",-0.1807,-78.4678,EC|Ecuador,Ecuador,"Latin America","Court Case",Submitted,2017,,,Approved,2021,,,,,,,,,,2017,"""The plaintiffs maintain that articles 86 and 136 of the contested agreement violate the rights of nature (arts. 71 and 72 of the Constitution), for requiring only administrative authorization from the Single Water Authority for the modification or diversion of water courses. Specifically, they allege that a significant deviation of the course of a river can imply irreversible damages to the seasonal rhythms and to the hydrological regime of the same"" (Page 3).",1,0,0,0,0,0,"Rights Of Nature","Fred Larreátegui Fabara, María Alejandra Zambrano Torres,Andrea Cristina Bravo Aguilar, Cristina Burneo Salazar, Ana Cristina Basrantes Puebla, Jaqueline Guanami Suárez, Pedro Emilio Manosalvas Paredes, Luis Felipe Quizhpe Querido and Nathalia Paola Bonilla Cueva",0,0,1,0,0,0,"Civil Society","the concentration of species that inhabit the river","All Nature",1,0,0,0,"The Constitutional Court approved a public action of unconstitutionality against articles 86 and 136 of the Environmental Regulation of Mining Activities.",https://ecojurisprudence.org/initiatives/inconstitutionality-of-the-mining-law/
425,"Ecuador Constitutional Court Case: Chibunga Urban Park Ordinance of 1997",-0.1807,-78.4678,EC|Ecuador,"Riobamba, Chimborazo Province, Ecuador","Latin America","Court Case",Submitted,2016,,,Failed,2021,,,,,,,,,,2016,"""Esperanza Martínez emphasizes that the Chibunga River must be recognized as a person, victim and subject of reparation because it has rights"" (Page 4).",1,0,0,0,0,0,"Rights Of Nature","Esperanza Martínez Yánez and Marco Alejandro Ruiz Salgado",0,0,1,0,0,0,"Civil Society",Nature,"Freshwater Ecosystem|Urban",1,0,0,0,"The court rejected a public action of unconstitutionality against an ordinance allowing agriculture, forestry and livestock activities the Chibunga Urban Park.",https://ecojurisprudence.org/initiatives/constitutionality-of-riobamba-ordinance-for-chibunga-urban-park/
426,"Colombia court case: rights of the Fortalecillas river",2.9345,-75.2809,CO|Colombia,"Huila Department, Colombia","Latin America","Court Case",Approved,2021,,,,,,,,,,,,,,2021,"""Therefore, full recognition will be given to the Fortalecillas River, as an entity subject to rights, whose protection, conservation, maintenance and restoration will be in charge of the State and the community"" (Page 27).",1,0,0,0,0,0,"Rights Of Nature","Johann Alexander Vargas Bedoya (Deputy of the Department of Huila)",0,0,0,0,1,0,Government,"Fortalecillas River","Freshwater Ecosystem",1,0,0,0,"A court in Colombia recognized the Fortalecillas River as an entity subject to rights to protection, conservation, maintenance and restoration.",https://ecojurisprudence.org/initiatives/fortalecillas-river/
427,"Ecuador Constitutional Court Case: Environmental Code provision regarding mangroves",-0.1807,-78.4678,EC|Ecuador,Ecuador,"Latin America","Court Case",Submitted,2018,,,Approved,2021,,,,,,,,,,2018,"""Recognize that mangrove ecosystems are holders of recognized rights to nature and have the right to 'that their existence and the maintenance and regeneration of their vital cycles, structure, functions and evolutionary processes are fully respected'"" (Page 40).",1,0,0,0,0,0,"Rights Of Nature","Ecuadorian Coordinator of Organizations for the Defense of Nature and Environment; the Asociación Animalista LiberaEcuador; Acción Ecológica",0,1,1,0,0,0,"NGO|Civil Society",Mangroves,"Forest|Marine Ecosystem",1,0,0,0," In 2021, Ecuador's Constitutional Court declared partial unconstitutionality of the Organic Environmental Code due to mangroves and rights of nature.",https://ecojurisprudence.org/initiatives/unconstitutionality-environmental-code-mangroves/
428,"International Rights of Nature Tribunal, 5th International Hearing: Glasgow 2021",55.8642,-4.2518,INT|International,"Glasgow, Scotland",International,"Civil Society Tribunal",Approved,2021,,,,,,,,,,,,,,2021,"""...the International Tribunal for the Rights of Nature, founded upon existing normative frameworks of universal law, which are inviolable, non-negotiable and applicable to all living beings, and applying the Universal Declaration for the Rights of Mother Earth, has found that the practices set out violate a number of the rights of Mother Earth and members of the Earth Community of some of the living beings of which she is composed."" (Page 2)",1,0,0,0,0,0,"Rights Of Nature","International Tribunal for the Rights of Nature; Global Alliance for the Rights of Nature (GARN)",0,1,1,0,0,0,"NGO|Civil Society","Mother Earth","All Nature",,0,0,0,"Judges at the 5th International Rights of Nature Tribunal in Glasgow, Scotland heard cases and applied the Universal Declaration for the Rights of Nature.",https://ecojurisprudence.org/initiatives/glasgow-rights-of-nature-tribunal/
429,"Peru court case: rights of the Marañón River",-4.2325,-74.2179,PE|Peru,"Kukama Indigenous Territory (Loreto Province, Peru)","Latin America","Court Case",Submitted,2021,,,Approved,2024,,,,,,,,,,2021,"""Recognition of the Marañón River and its tributaries as subjects of rights by the court, with intrinsic value, which must be protected, especially in attention to the spiritual value that this river has for indigenous peoples in general, and especially for the Kukama indigenous people"" (page 4). ""On the other hand, we propose an interpretation of the river as a subject of law, based on the fundamental right to live in a balanced environment suitable for life and based on the rights of indigenous peoples"" (Page 8).",1,1,0,0,1,0,"Rights Of Nature|Personhood|Indigenous Model","Huaynakana Kamatahuara Kana; Mari Luz Canaquiri Murayari",1,1,0,0,0,0,Indigenous|NGO|Women,"Marañón River","Freshwater Ecosystem",1,3,3,1,"In March 2024, the Federation of Kukama-Kukamiria Women from Peru's Amazon won a lawsuit seeking rights for the Marañón River, due to systematic oil spills.",https://ecojurisprudence.org/initiatives/rights-of-maranon-river-case/
430,"Mexico Supreme Court Case: mangroves in Laguna del Carpintero",22.229167,-97.855278,MX|Mexico,"Tamaulipas State, Mexico","Latin America","Court Case",Submitted,2013,,,Approved,2018,,,,,,,,,,2013,"""The recognition of this human right [to a healthy environment] requires understanding that humans coexist with and are part of the ecosystems that nature itself creates"" (39) ... ""Hence, the scope of protection of this human right seeks to regulate human activities to protect nature, which implies that its essential core of protection goes even beyond the most immediate objectives of human beings; in other words, this right not only addresses the right of human beings to live in a healthy and dignified environment, but also protects nature for the value it has in itself"" (page 40).",0,0,0,0,0,1,"Eco-Governance System","Supreme Court of Justice",0,0,0,0,0,1,Court,"Mangrove swamp located in the Laguna del Carpenter","Forest|Freshwater Ecosystem|Urban",1,0,0,0,"In 2018, Mexico's Supreme Court ruled an urban park violates the human right to a healthy environment, which encompasses inherent eco-centric protections.",https://ecojurisprudence.org/initiatives/constitutional-appeal-to-protect-mangroves-in-laguna-del-carpintero/
431,"France Citizen Declaration: rights of the Tet River",42.7124,3.0360,FR|France,"Pyrénées-Orientale, France",Europe,"Civil Society Declaration",Drafted,2021,,,,,,,,,,,,,,2021,"""The Tet river is a living and indivisible entity from its source to its mouth, delimited by its watershed, and has legal personality"" (Page 3).",1,1,0,0,0,0,"Rights Of Nature|Personhood","En Commun 66",0,1,0,0,0,0,NGO,"The Tet River","Freshwater Ecosystem",1,2,2,2,"In 2021, the NGO En Commun 66 in France wrote a Declaration of the Rights of the Tet River to give the river a legal personality.",https://ecojurisprudence.org/initiatives/declaration-of-the-rights-of-the-tet-river/
432,"Ridgway (USA) Resolution: rights of the Uncompahgre River",38.1526,-107.7556,US|USA,"Colorado, USA","North America",Declaration,Approved,2021,,,,,,,,,,,,,,2021,"""The Uncompahgre River, its tributaries, and the Uncompahgre River Watershed, along with the living and other things existing naturally within them, exist and function as an integrated and interdependent system of natural communities and are therefore understood, respected, and recognized in this Resolution as a living entity, possessing fundamental and inalienable rights"" (Page 3).",1,0,0,0,0,0,"Rights Of Nature","Town Council",0,0,0,0,1,0,Government,"The Uncompahgre River","Freshwater Ecosystem",1,3,1,2,"In 2021, the town of Ridgway, Colorado adopted a resolution recognizing the rights of the Uncompahgre River, tributaries, and watershed.",https://ecojurisprudence.org/initiatives/ridgway-resolution-recognizing-the-rights-of-the-uncompahgre-river/
433,"Ecuador Constitutional Court Case: rights of the Aquepi River",-0.1807,-78.4678,EC|Ecuador,"Santo Domingo Province, Ecuador","Latin America","Court Case",Submitted,2019,,,Approved,2021,,,,,,,,,,2019,"""Recognize that the Aquepi River is subject and holder of the rights recognized to thenature and has the right to have its structure and operation respectedaffect its flow"" (Page 24).",1,0,0,0,0,0,"Rights Of Nature","Residents of Julio Moreno Espinosa and San Vicente de Aquepi",0,0,1,0,0,0,"Civil Society","Aquepi River","Freshwater Ecosystem",1,0,0,0,"The court declared that the Ministry of Water violated the rights of the Aquepi River by taking water in a quantity exceeding its ecological flow in dry season.",https://ecojurisprudence.org/initiatives/rights-of-aquepi-river-case/
434,"Sauk-Suiattle (USA) Tribal Court Case: Tsuladxw (salmon) v. City of Seattle",48.2554,-121.6015,US|USA,"Sauk-Suiattle Tribal Territory (Washington, USA)","North America","Court Case",Submitted,2022,,,Approved,2023,,,,,,,,,,2022,"""Recognition that Tsuladxw (salmon) possess the 'inherent right to exist, flourish, regenerate, evolve, as well as an inherent right to restoration, recovery, and preservation' (Page 2 of press release).",1,0,1,0,1,0,"Rights Of Nature|Animal Rights|Indigenous Model","Sauk-Suiattle Indian Tribe, in its capacity as a tribal nation and as the Sahkuméhu for and on behalf of Tsuladxw (salmon)",1,0,0,0,0,0,Indigenous,"Tsuladxw (salmon)",Animal,1,2,2,1,"January 2022, the Sauk-Suiattle Indian Tribe sued the City of Seattle in Tribal Court seeking recognition of the rights of Tsuladxw (salmon in Tribe’s language)",https://ecojurisprudence.org/initiatives/rights-of-salmon-case/
435,"Panama National Rights of Nature Law of 2022",8.9824,-79.5199,PA|Panama,Panama,"Latin America",Legislation,Submitted,2020,,,Approved,2022,,,,,,,,,,2020,"""The law requires the state and all persons, whether natural or legal (such as corporations), to respect and protect Nature's rights. Some of Nature's rights recognized in the law include Nature's rights to exist, persist, and regenerate its life cycles; Nature's right to timely and effective restoration; and Nature's right to the preservation of its water cycles"" (Press Release).",1,0,0,0,0,0,"Rights Of Nature","Callie Veelenturf (The Leatherback Project); Congressman Juan Diego Vásquez Gutiérrez",0,1,0,0,1,0,Government|NGO|Women,Nature,"All Nature",,1,3,2,"In 2022, Panama passed a national Rights of Nature Law that recognizes Nature as a subject of rights, its intrinsic value, and ecocentric principles.",https://ecojurisprudence.org/initiatives/panama-rights-of-nature-law/
436,"Chile Constitutional Amendment: rights of nature",-33.447487,-70.673676,CL|Chile,Chile,"Latin America",Constitution,Failed,2022,,,,,,,,,,,,,,2022,"Nature has the right to be respected and to exist, regenerate, and maintain and restore its functions and dynamic balances, which include natural cycles, ecosystems and biodiversity.",1,0,0,0,0,0,"Rights Of Nature","Defensa Ambiental, Earth Law Center",0,1,1,0,0,0,"NGO|Civil Society",Nature,"All Nature",,2,1,0,"In September 2022, Chilean voters rejected a proposed new Constitution that, among other things, recognized rights of Nature.",https://ecojurisprudence.org/initiatives/initiative-to-recognize-rights-of-nature-in-chilean-constitution/
437,"New Zealand Law: Ngāi Tahu Claims Settlement Act 1998",-43.5320,172.6306,"NZ|New Zealand","South Island, Aotearoa (New Zealand)",Oceania,Legislation,Approved,1998,,,,,,,,,,,,,,1998,"Ecosystems as living spiritual beings; Ecosystems as living spiritual beings; S 206 ""The Crown acknowledges the statements made by Te Rūnanga o Ngāi Tahu of the particular cultural, spiritual, historic, and traditional association of Ngāi Tahu with the statutory areas, the texts of which are set out in Schedules 14 to 77."" From 14 - 77 the Act contains the following quote relating to each area - ""... represents the essence that binds the physical and spiritual elements of all things together, generating and upholding all life. All elements of the natural environment possess a life force, and all forms of life are related.""",0,0,0,0,1,0,"Indigenous Model","Te Rūnanga o Ngāi Tahu; Prime Minister James Brendan Bolger (for the Crown) ",1,0,0,0,0,0,Indigenous,"""statutory areas"" Include nearly 100 different Ecological entities including Aoraki/Mount Cook","All Nature|Mountain",1,0,0,0,"This Act required the settlement of all of Ngāi Tahu’s historical claims and contains the recognition of the mauri (life force) of each different site.",https://ecojurisprudence.org/initiatives/new-zealand-ngai-tahu-claims-settlement-act-1998/
